title,score,id,url,comms_num,created,body,timestamp
My confidence is destroyed,18,zmilnh,https://www.reddit.com/r/Tinder/comments/zmilnh/my_confidence_is_destroyed/,42,1671102750.0,"I (23M) I have been using tinder and other apps for a few months and so far the experience has been nothing but painful

I purchased premium on all the major platforms to get unlimited swipes to give myself the best chance and so far across every app I’ve matched with a total of 3 woman. None of which replied to my first text.

I never thought I was hotshit but I never realised how truly invisible I must be.

I just don’t understand what I need to do to draw anyone’s attention.

I’m not overweight, I have a good stable income, im not self deprecating and I like to think I don’t come across creepy or desperate.

What am I doing wrong or is this just the way it is",2022-12-15 13:12:30
I don’t even know what to do with this information,723,zmhljf,https://i.redd.it/95kw2lotu26a1.jpg,165,1671098840.0,,2022-12-15 12:07:20
Any improvements?,0,zmh3qr,https://www.reddit.com/gallery/zmh3qr,43,1671096931.0,,2022-12-15 11:35:31
I wonder which of these 3 I'm going to get,349,zmguxl,https://www.reddit.com/gallery/zmguxl,58,1671095956.0,,2022-12-15 11:19:16
3rd times the charm ?,3,zmg6lv,https://i.redd.it/415z8cy2e26a1.jpg,6,1671093210.0,I’m just trying to give a short but interesting bio abt me. Tel me how it is,2022-12-15 10:33:30
Bro I... Y'all think I still have a chance tho?,177,zmfuoe,https://i.redd.it/ad8b9wm0a26a1.png,135,1671091844.0,,2022-12-15 10:10:44
i think they need therapy maybe?,31,zmfo2h,https://i.redd.it/lr7cx2wv726a1.jpg,5,1671091126.0,,2022-12-15 09:58:46
"What's the European (metric) version of ""Will only date guys over 6 feet tall""?",0,zmfn27,https://www.reddit.com/r/Tinder/comments/zmfn27/whats_the_european_metric_version_of_will_only/,11,1671091005.0,"In the US, some women will say in their profile, ""Will only date guys over 6 feet tall,"" or will set their search parameters for 6 feet and taller. Six is an easy number to indicate tall (in feet) under the US measuring system.

What's the equivalent of this type of height requirement in countries that use the metric system? I saw some mentions online that people will say 180 cm.

6 feet = 182.88 cm

180 cm = 5 feet, 10.87 inches",2022-12-15 09:56:45
"I matched with this girl a month ago. Got her number, talked for like a week then set up a date time. She rescheduled on me, then ghosted the second date. I delete hinge and remake it, she just sent me a like. I hate it here.",21,zmfm9r,https://i.imgur.com/GgQWZgO.png,15,1671090916.0,,2022-12-15 09:55:16
Never asked a girl out before so I have no idea what to do lol. does this sound like a good thing to write? any suggestions are welcome!,658,zmfk8d,https://i.redd.it/58o9h2qk626a1.png,246,1671090686.0,,2022-12-15 09:51:26
"I fixed my bio, which out of these 3 is the best fit ?",0,zmfi3z,https://i.redd.it/retk06xv526a1.jpg,13,1671090453.0,,2022-12-15 09:47:33
need some advice,3,zmfi0a,https://www.reddit.com/r/Tinder/comments/zmfi0a/need_some_advice/,4,1671090441.0,Anyone have any tips on getting noticed/responses on here? I never ever seem to get any sort of replies. Any help with getting my profile noticed?,2022-12-15 09:47:21
Ladies And Gentlemen About to start Tinder for the First time so please honest opinion which picture should stay and which should go.,15,zmf3ok,https://www.reddit.com/gallery/zmf3ok,35,1671088899.0,,2022-12-15 09:21:39
Is this too much/ too little ?,0,zmf2dm,https://i.redd.it/kzrp7g7w026a1.jpg,4,1671088775.0,First sentence was from another Redditor,2022-12-15 09:19:35
Something went wrong A:42901,2,zmetjc,https://i.redd.it/sycekey7y16a1.jpg,0,1671087877.0,"I can’t login to Tinder all of a sudden, I’ve reinstalled the app, cleared my cache, tried Tinder.com, contacted Tinder and followed all their steps/asked if I’m banned for some reason, but they assure me I’m not. 

Is there a fix for this?",2022-12-15 09:04:37
Moved to Japan and I jumped back on tinder after years of not using it. Is this joke still funny? Details in comments,6,zmeq9p,https://i.redd.it/8qytknrbx16a1.jpg,8,1671087575.0,,2022-12-15 08:59:35
quitting online dating,370,zme4sh,https://www.reddit.com/r/Tinder/comments/zme4sh/quitting_online_dating/,273,1671085444.0,"I recently did a test. I was getting no matches and would go 6 months before a match came in just to be ghosted or unmatched. So I did a little experiment. 

I added what my salary first off. Then what kinda car I drove. Within the first week....27 matches. 

Men, we don't need to put up with this shit. If a woman only likes you because of your money and status...she doesn't like you. She likes the idea of being spoiled like she's some preteen princess. 

Know your worth and find someone who does as well.",2022-12-15 08:24:04
I swiped left on this person who popped up in my feed yet their profile is still in my messages how can I make it go away?,2,zmdy9v,https://i.redd.it/4u74eah5p16a1.jpg,3,1671084826.0,I don’t have tinder hold btw so I can’t just my ally unmatch from them.,2022-12-15 08:13:46
what do I do now,4,zmdngg,https://i.redd.it/3xiy86c4m16a1.jpg,6,1671083806.0,,2022-12-15 07:56:46
Fuck Jim!!!,8543,zmdmnf,https://i.redd.it/ajpuulxvl16a1.jpg,359,1671083728.0,,2022-12-15 07:55:28
"If people in your feed were very attractive and then gradually are not, does it mean your elo fell??",5,zmdmif,https://www.reddit.com/r/Tinder/comments/zmdmif/if_people_in_your_feed_were_very_attractive_and/,1,1671083713.0,"Basically the question.  I live in a college town and a lot of my matches and the people in my feed were very attractive for about 2 to 3 months.  Recently however, the profiles in my feed have been lower quality and much less attractive. Did my elo score fall or is this simply the woes of a smaller town and having swiped through or matched all of the attractive people in my area?",2022-12-15 07:55:13
Girl added me on tinder and pretended to like me just to make fun of me,508,zmdaxp,https://www.reddit.com/gallery/zmdaxp,127,1671082603.0,,2022-12-15 07:36:43
and this is why i don’t really use dating apps (from a couple days ago),35,zmd7zp,https://i.redd.it/cs6ogiwoh16a1.jpg,10,1671082316.0,,2022-12-15 07:31:56
"Well, that escalated quickly",2303,zmd2js,https://www.reddit.com/gallery/zmd2js,449,1671081817.0,,2022-12-15 07:23:37
Family: how has your dating life been? Me: *opens tinder chat* 😒,36,zmcs1g,https://i.redd.it/z2duh2bbd16a1.jpg,3,1671080845.0,,2022-12-15 07:07:25
"Nice guys always finish last, smh.",0,zmck7c,https://i.redd.it/ho700kwmtz5a1.png,63,1671080137.0,,2022-12-15 06:55:37
It's weird for a girl to ask you to hang out like right away right?,2,zmc7sn,https://www.reddit.com/r/Tinder/comments/zmc7sn/its_weird_for_a_girl_to_ask_you_to_hang_out_like/,3,1671079014.0,"dont have the complete screencap cuz i unmatched but i matched with a pretty attractive girl (granted she is the type that generally goes for me) and she texted me first ""heyyyy"", and cery quickly excalated the convo into ""do you drive"" and ""you should pick me up"". Got kinda weirded out by this because of how quickly she responded to everything and how soon she implied we should meetup. Was I stupid in unmatching?",2022-12-15 06:36:54
I need some pointers to dig myself out of this hole.,1,zmc1am,https://i.redd.it/gokkry55616a1.jpg,10,1671078433.0,,2022-12-15 06:27:13
good morning,47,zmbq02,https://i.redd.it/48jzmsr5316a1.png,0,1671077431.0,,2022-12-15 06:10:31
I guess that’s a strategy?,33,zmb9fy,https://i.redd.it/jmkggr7xy06a1.jpg,12,1671076004.0,,2022-12-15 05:46:44
This is where I peak in life,0,zmams6,https://i.redd.it/umk8q0t8t06a1.jpg,6,1671074097.0,,2022-12-15 05:14:57
Decoding tinder bio vocabuloary (women edition),5,zm9wsc,https://www.reddit.com/r/Tinder/comments/zm9wsc/decoding_tinder_bio_vocabuloary_women_edition/,9,1671071976.0,"If the girl uses the following words in the bio:  
Not looking for anything serious = open to meet, but probably never checks Tinder

Here for a good time, not a long time = looking for a male sex toy, expect to be treated as one

No hookups = looking for friends 

Let's go on hikes = one night stand 

Looking for dog daddy = want to go on cute dates

Partnered, looking for new friends = possible ongoing fwb situation

Poly/ENM = they make friends by having sex with them (different from fwb as you are now one of their partners, expecting deeper connection)

Mom of x = She is very busy and she knows how shitty man can be

Love anime and plays video games = lowkey depressed, have anxiety, knows the internet/culture very well

Can beat you in Mario Kart = have brothers, acts mostly like a bro, competitive

Snapchat @ = too young for you to keep up

anything relate to vaccine = very political, either with her or without her

Food = she is broke

Travel = She has lots of choices 

gym = all about self-improvement

\------------------

This is my understanding so far, feel free to add your opinions, experiences, and tell me why I'm wrong ;)",2022-12-15 04:39:36
rate my rizz??,1,zm9bzd,https://i.redd.it/r1pvvk0yh06a1.jpg,12,1671070296.0,,2022-12-15 04:11:36
i reactivated my profile two hours ago.,43,zm9b8n,https://www.reddit.com/gallery/zm9b8n,23,1671070240.0,,2022-12-15 04:10:40
Banned account,2,zm99pq,https://www.reddit.com/r/Tinder/comments/zm99pq/banned_account/,8,1671070127.0,"So I’ve had this account for about 6 months and it was pretty ok. My photos were all mine, with no nudity and there was nothing offensive in my description. I haven’t had any problems in my matches as well. This week, tho, out of the blue, o got permanently banned. I even sent them a message asking the reason, so I could check what happened, but the answer was “we can’t tell you”. Any ideas on what might have happened ?",2022-12-15 04:08:47
Has anyone actually used these generated messages? W/L?,3,zm96q6,https://i.redd.it/wxcw8z6rg06a1.jpg,3,1671069895.0,,2022-12-15 04:04:55
Is over 100 likes is 4 hours of creating an account normal for Tinder?,0,zm8xsa,https://www.reddit.com/r/Tinder/comments/zm8xsa/is_over_100_likes_is_4_hours_of_creating_an/,44,1671069213.0,"F(22) Created account earlier today and within 4 hours I had over 100 likes. Never had tinder before so I don’t know if this is normal of the app. Or I have just been self conscious for years for no reason? 

Going through a rough break up and I’m pretty sure he ain’t coming back so my friends suggested tinder to occupy myself.",2022-12-15 03:53:33
What was he expecting???,5838,zm8vrv,https://i.redd.it/k9099q39e06a1.jpg,553,1671069053.0,,2022-12-15 03:50:53
This escalated quickly,553,zm8lwt,https://i.redd.it/7hre7neyb06a1.jpg,39,1671068281.0,,2022-12-15 03:38:01
What can improve?,5,zm8ldh,https://i.redd.it/eii8ubttb06a1.jpg,8,1671068237.0,,2022-12-15 03:37:17
Same number for multiple different accounts.,1,zm7nvx,https://www.reddit.com/r/Tinder/comments/zm7nvx/same_number_for_multiple_different_accounts/,5,1671065696.0,I used the same number for a few different accounts and now I’m banned. Does that mean someone reported me or does it mean Tinder just recognized I kept making different accounts with the same number?,2022-12-15 02:54:56
Why did I get banned? 😭 I didn't even do anything malicious. Only chatting and swiping slowly.,1,zm79v2,https://i.redd.it/tpr0tav1106a1.png,5,1671064618.0,,2022-12-15 02:36:58
"Bought Platinum, now i feel dumb lol",2,zm76k6,https://www.reddit.com/r/Tinder/comments/zm76k6/bought_platinum_now_i_feel_dumb_lol/,1,1671064374.0,"So I’ve been on and off Tinder for a couple years now, I’ve never got a ton of likes but Id say 40-50 on the regular, but it would just die right there and id  never get a like. I know im an attractive guy since i’ve been on a couple of dates just through Tinder and had a couple of flings within the last year.

Im on a business trip for a couple months in a new city area and I remade a new account (Ive deleted and made a new account a bunch of times, especially on the same sim card) but i only got a handful of likes and it just stopped, I dealt with it for a week and caved and bought Platinum. Then I received 5-6 more likes and a couple more matches and then it died again most likely from the algorithm killing my ELO.

Am I screwed and fell for the Platinum membership?",2022-12-15 02:32:54
Her bio said she’d buy the first round if you guess her middle name with one clue. I’m stumped.,7644,zm737f,https://i.redd.it/iey2szllzz5a1.jpg,2202,1671064128.0,,2022-12-15 02:28:48
"New on tinder, searching for help in the best place of the whole internet",0,zm6lks,https://www.reddit.com/gallery/zm6lks,13,1671062834.0,,2022-12-15 02:07:14
"honestly, respect",77,zm5p77,https://i.redd.it/fta3jjlsoz5a1.jpg,25,1671060499.0,,2022-12-15 01:28:19
How to say hi in red,6,zm5nhk,https://i.redd.it/ipz48tzfoz5a1.jpg,10,1671060374.0,,2022-12-15 01:26:14
"Brutal instagram reality AKA ""where did my mouth go?""",4,zm5ezw,https://i.redd.it/r3jke7a35y5a1.jpg,1,1671059782.0,,2022-12-15 01:16:22
How big are you?,18962,zm5a26,https://imgur.com/AYq7nKH.jpg,411,1671059443.0,,2022-12-15 01:10:43
"Lots of matches, but no dates",0,zm53xa,https://www.reddit.com/r/Tinder/comments/zm53xa/lots_of_matches_but_no_dates/,12,1671059009.0,"This is an issue I’ve encountered on a couple of dating apps, but it’s far and away the worst on Tinder. 

I can’t really identify where I might be going wrong. I make an effort to usually open with like a joke relevant to their bio or a question (again specific to their bio).

So I’m either fumbling super fuckin’ hard right out of the gates literally all the time OR they just weren’t that attracted to me begin with, but maybe figured I was funny or something (this is usually why I’ll ghost a match so maybe I am just projecting).

Any insights?",2022-12-15 01:03:29
Am I being catfished?,1,zm4pux,https://www.reddit.com/r/Tinder/comments/zm4pux/am_i_being_catfished/,8,1671058052.0,So this girl (pretty blonde) on tinder asks if I have a telegram and says I should get one so we can chat off of tinder. Am I being scammed/catfished?,2022-12-15 00:47:32
"Right or Left, What do you think?",5,zm4duc,https://www.reddit.com/gallery/zm4duc,5,1671057235.0,,2022-12-15 00:33:55
Why people use this stupid lines?,0,zm4bmw,https://www.reddit.com/r/Tinder/comments/zm4bmw/why_people_use_this_stupid_lines/,6,1671057079.0,"I mean, I really don’t understand it. Are you going to talking with your girl the same way or how? Stop using fake personality and start to talk about you really want to finding your perfect life match? If you just looking for the 1 night stop you can say it without your fake lines? ? Isn’t it the best way to find your soulmate without saying fake internet shit ??",2022-12-15 00:31:19
Who's Cody,13,zm48l0,https://www.reddit.com/gallery/zm48l0,8,1671056880.0,This interaction confused me tonight,2022-12-15 00:28:00
Bug on tinder?,4,zm3x9b,https://www.reddit.com/r/Tinder/comments/zm3x9b/bug_on_tinder/,6,1671056105.0,"Hey there, I don´t know if it is well known bug, but it works on my, and my friends tinder. If you close the app, and then open it again, the second right swipe is always a match (if at least one person likes you).",2022-12-15 00:15:05
like… why?,70,zm3qru,https://i.redd.it/kxtmge8faz5a1.jpg,41,1671055659.0,,2022-12-15 00:07:39
Is it common to get unmatched because of your job?,3,zm3o8j,https://www.reddit.com/r/Tinder/comments/zm3o8j/is_it_common_to_get_unmatched_because_of_your_job/,20,1671055496.0,"Hi all,

Just got yet another unmatch when i mentioned my job and i'm really confused why. I think my profile is good, I got advice on here earlier for it and get a reasonable amount of likes and matches every month.

I don't list my job on my profile anymore.  Initially I had it as ""good job"" but maybe my version of good job (IT in the public sector that pays 70+K a year with a really nice pension) and most people's are different.

Even after I took it out of my profile, I get matches and usually the 1st or 2nd question is about my job...which is fine.. I reply...and then change the subject with a witty quirp because I don't want to make chatting with a match feel like i'm going to a job interview.  I think like every 5th or 6th match, unmatches me after i disclose what my job is.

I don't get it, at all. I know 70k isn't big balling,especially now adays but there isn't too many people I know, men and women alike who make noticeably more than that.

Should i try sprucing up my job when I reply?  I usually say something along the lines of IT in the (name of the department) doing (x work) and then quickly move to talking about something else.  Any suggestions would be really welcomed.",2022-12-15 00:04:56
The only girls that actually respond to me are most likely scammers.,1,zm3kuj,https://www.reddit.com/r/Tinder/comments/zm3kuj/the_only_girls_that_actually_respond_to_me_are/,2,1671055264.0,For the most part the only girls who I have a back and forth conversation with on tinder end up being catfish. Yay,2022-12-15 00:01:04
Rizz meter📈📈,14,zm3bq8,https://i.redd.it/jxl42g6f7z5a1.jpg,1,1671054649.0,,2022-12-14 23:50:49
Spotted in the wild,47,zm38yr,https://i.redd.it/i18pp05v6z5a1.jpg,41,1671054462.0,,2022-12-14 23:47:42
I’m sorry… What?,19,zm33oi,https://i.redd.it/m9d5b5ut5z5a1.jpg,14,1671054116.0,This made me lose MY faith in humanity.,2022-12-14 23:41:56
Mr. smooth talk over here ...he gave out his whole address after 1 message,8,zm2xta,https://i.redd.it/fj8vrsqn4z5a1.png,7,1671053721.0,,2022-12-14 23:35:21
(update) got a meet with the glory hole,10,zm1zxw,https://www.reddit.com/gallery/zm1zxw,11,1671051455.0,,2022-12-14 22:57:35
I think there was something funny in that hippie.,30,zm1wlz,https://i.redd.it/k34y7rllfx5a1.png,6,1671051212.0,,2022-12-14 22:53:32
So showering everyday makes you perfect nowadays?🤣,6,zm1nxj,https://i.redd.it/nnwlvfjdvy5a1.jpg,9,1671050598.0,,2022-12-14 22:43:18
Not an appropriate intro 🤣,30,zm1mgy,https://i.redd.it/0zm31ws1vy5a1.jpg,23,1671050488.0,,2022-12-14 22:41:28
Mother is Not Impressed w/Penis Pics,16,zm1ag4,https://www.reddit.com/r/Tinder/comments/zm1ag4/mother_is_not_impressed_wpenis_pics/,10,1671049633.0,"This morning I explained the concept of unsolicited penis pics being a common thing to my 74 year old mother.

She said y'all should be ashamed of yourselves.",2022-12-14 22:27:13
Have Mercy,40,zm0xjd,https://i.redd.it/a2cq8vcvpy5a1.jpg,3,1671048746.0,,2022-12-14 22:12:26
Girl re-likes me after rejection,1,zm0uum,https://www.reddit.com/r/Tinder/comments/zm0uum/girl_relikes_me_after_rejection/,5,1671048565.0,"One month ago, i matched with her and i instantly asked her out...(She had nothing on her profile, i had enough rejections, felt like i have nothing to lose)...She replied positively and then deleted me.

Now, she appeared again with a new like.

I don't have any experience, only rejections, so i don't know what to make out of this... Give me your thoughts.",2022-12-14 22:09:25
A pickup line that works? Say no more!,96,zm0o6w,https://www.reddit.com/gallery/zm0o6w,6,1671048122.0,,2022-12-14 22:02:02
Do you wanna make out with a mermaid?,4,zm0em5,https://www.reddit.com/gallery/zm0em5,2,1671047472.0,,2022-12-14 21:51:12
Every bad match is just one swipe closer to love ❤️,21,zm05y8,https://www.reddit.com/gallery/zm05y8,5,1671046843.0,,2022-12-14 21:40:43
The call is coming from inside the house,1697,zm036g,https://i.redd.it/5pfwjj9mjy5a1.jpg,127,1671046644.0,,2022-12-14 21:37:24
I regret asking for more info,8,zlzzkg,https://www.reddit.com/gallery/zlzzkg,3,1671046383.0,,2022-12-14 21:33:03
How not to pick up the ladies,64,zlztuy,https://www.reddit.com/gallery/zlztuy,66,1671045972.0,,2022-12-14 21:26:12
This works quite well ngl,18,zlznkx,https://i.redd.it/9bc3xqi9gy5a1.jpg,4,1671045516.0,,2022-12-14 21:18:36
Wdyt of this bio?,18,zlzi1q,https://i.redd.it/rroq18c2fy5a1.jpg,30,1671045112.0,,2022-12-14 21:11:52
I’m not going to find a decent guy am I?,100,zlzc36,https://i.redd.it/ae9pn1stdy5a1.jpg,73,1671044696.0,"Seriously, I’m not looking for a full on romance but this is getting beyond a joke. Nearly every single guy I’m talking to eventually steers the convo to something cringe and overtly sexual. Is it pointless looking for dates and seeing where it goes?? Because everyone seems to be “claiming” that’s what they want and then jumping right in asking inappropriate ish. Also does this actually work for people because me and my gal pals think they’re disgusting and reek of desperation- immediately unmatched. ( this guy said far worse than this after I didn’t answer btw).",2022-12-14 21:04:56
Passport Success Story,5,zlyq0r,https://www.reddit.com/r/Tinder/comments/zlyq0r/passport_success_story/,5,1671043191.0,"I decided to try passport feature just for fun to see other cultures and maybe find some long distance pen pals.

I see a lot of random hate on people using passport. Such as men using it as an “ego boost” and wasting time.

My whole framework was just for fun and pen pals though. 

Moral of the story I met a gal from El Salvador that just graduated university and can speak very good English. We had been talking as friends and developed a dope relationship.


I just booked a flight and Airbnb down to El Salvador I’m going to learn to surf and I’m also going to take this girl on a date in a couple months.

Just thought I’d share it to show it doesn’t have to be a 0 sum game.",2022-12-14 20:39:51
Help?,1,zlynx2,https://www.reddit.com/r/Tinder/comments/zlynx2/help/,0,1671043052.0,"So i have like 19 likes but literally none of them seem to be popping up on my scroll, any way i can try and fix it without getting gold? I dont think the 2nd profile trick is working either so im stuck lol",2022-12-14 20:37:32
"We all feel you, Kate.",862,zlyly8,https://i.redd.it/8agibw9j8y5a1.jpg,51,1671042917.0,,2022-12-14 20:35:17
When your personality is vegan as fuck and not much else…,2,zlylah,https://i.redd.it/jokal64f8y5a1.jpg,8,1671042879.0,,2022-12-14 20:34:39
"Pray for me, bros!",1,zlyekt,https://i.redd.it/qsxtkq5kpw5a1.png,8,1671042438.0,,2022-12-14 20:27:18
Random unmatch?,1,zly5wr,https://www.reddit.com/r/Tinder/comments/zly5wr/random_unmatch/,14,1671041874.0,"I matched with this lass on tinder and I complimented her photos to which she replied thanking me and I’d looked on her profile to see what interests she has.

She had in her profile that she’s a night owl and that she’s a marvel fan which I am as well and when I mention this to her, she unmatches me? Sometimes I feel like you can’t win on this app",2022-12-14 20:17:54
[UPDATE] I took all of your suggestions! Is there anything else I can do to improve my profile?,33,zlxdfz,https://www.reddit.com/gallery/zlxdfz,37,1671040030.0,So far I have 17 likes and 2 matches with a week old profile :),2022-12-14 19:47:10
Profile for tinder/hinge review,14,zlxapn,https://www.reddit.com/gallery/zlxapn,17,1671039853.0,,2022-12-14 19:44:13
"Someone had their cat as their profile, been good friends for about a month now",63,zlxagf,https://i.redd.it/g74h9qquhw5a1.jpg,8,1671039837.0,,2022-12-14 19:43:57
Want a feedback if this profile on my tinder should have any kind of changes,0,zlx9t8,https://www.reddit.com/r/Tinder/comments/zlx9t8/want_a_feedback_if_this_profile_on_my_tinder/,0,1671039796.0,"Took brand new pictures and thinking about using this pictures for my tinder and want a feedback before I go ahead with it thanks this is also on my hinge profile but barely getting matches I don’t know if I should change anything 
Will post the profile in a separate thread",2022-12-14 19:43:16
"As a bisexual french boy on Tinder, after a few days of using the app, only boys answer to my messages (Yes i downloaded Tinder to verify all the bad stuff that was said about it)",2,zlx11f,https://i.redd.it/g6rnv45jxx5a1.jpg,6,1671039218.0,,2022-12-14 19:33:38
Just a reminder to be positive. Stuff like this isn’t very flattering.,13,zlwt2u,https://i.imgur.com/U8gYpcf.jpg,2,1671038708.0,,2022-12-14 19:25:08
Tinder & Google Forms,8,zlw9qw,https://www.reddit.com/gallery/zlw9qw,4,1671037431.0,"This is a new one... Fill out my Google Form before we even have a conversation 😂

I need to get off this fucking app 🙄

P.S. second try with this post because I forgot to upload the pic with my email blocked out 🤦‍♂️",2022-12-14 19:03:51
The most voted comment would be my first message to all my matches this week,2,zlw9nm,https://www.reddit.com/r/Tinder/comments/zlw9nm/the_most_voted_comment_would_be_my_first_message/,25,1671037424.0,"Just for the laughs I would use the comment as my opening message. And share the results after a week. 

May be I'll find love this way?! 

I'm F looking for M, btw! 

PS. We'll only proceed if there are reasonable  number of comments and likes.",2022-12-14 19:03:44
"Hello! I just joined Tinder, can yall qritique my profile",0,zlw7hj,https://i.redd.it/n1jtbe7srx5a1.jpg,8,1671037284.0,,2022-12-14 19:01:24
Well that escalated quickly,20718,zlvsj9,https://i.redd.it/4ie12xcuox5a1.jpg,1567,1671036295.0,,2022-12-14 18:44:55
Felt like this died completely randomly,137,zlvftq,https://i.redd.it/avi4zku8mx5a1.png,79,1671035421.0,,2022-12-14 18:30:21
who tf is swiping on profiles like this? nobody I hope.,0,zlv6fh,https://i.redd.it/ovw9j88dkx5a1.jpg,35,1671034790.0,,2022-12-14 18:19:50
Weekly story time thread,25,zlv2ew,https://www.reddit.com/r/Tinder/comments/zlv2ew/weekly_story_time_thread/,110,1671034511.0, Feel free to use this thread to discuss all of your Tinder dates from the past week.,2022-12-14 18:15:11
Weekly Profile Review Thread,27,zluoqj,https://www.reddit.com/r/Tinder/comments/zluoqj/weekly_profile_review_thread/,503,1671033610.0, Post information about you/your profile here and get it reviewed by other people on /r/Tinder.,2022-12-14 18:00:10
