title,score,id,url,comms_num,created,body,timestamp
Comment,1,j0stwkm,,0,1671421205.0,You look like a girl I met that turned out to be a man.,2022-12-19 05:40:05
Comment,1,j0stvor,,0,1671421192.0,This ..,2022-12-19 05:39:52
Comment,1,j0stv7c,,0,1671421186.0,This is direct,2022-12-19 05:39:46
Comment,1,j0stut6,,0,1671421180.0,What’s your introductory message when you match with someone?,2022-12-19 05:39:40
Comment,1,j0stu44,,0,1671421171.0,"...wait

Are you then an inner demon whore? Cause baby, I got *plenty*",2022-12-19 05:39:31
Comment,1,j0sttdt,,0,1671421161.0,"Also, has he heard of sentences?",2022-12-19 05:39:21
Comment,1,j0stsrb,,0,1671421152.0,"Well...

We're waiting...

How was the coke?",2022-12-19 05:39:12
Comment,1,j0str5l,,0,1671421130.0,“I hope you mean at chess…” I say give it a go,2022-12-19 05:38:50
Comment,1,j0stq6b,,0,1671421116.0,"As a Canadian, I can say I've also never gears of bridge day.",2022-12-19 05:38:36
Comment,1,j0stonn,,0,1671421094.0,"*** disclaimer: im a 50 year old married women who never used tinder or anything else out there. i have no idea of these suggestions will work lol***

Ok so I would start with your bio..

Animal lover: volunteer for a local rescue adoption event or rescue.. you can chill with pups until you can get one, you are doing something good and picture op (I said what I said and I ain't going back lol)

Travel + Photography: combine the two and post some pics..maybe make a collage type picture. 

Sports: are you an avid sports fan? Stick one of those in the pics

Bachelor's degree: list those suckers, post pics of graduation, be proud of them.

European/Canadian... um no... put Canadian/European descent sounds a bit better

Whole foods date? Dog dad? 
No, just no.
I dunno what to replace it with but just no..

Maybe: 
Hanging in Whole Foods and walk your dog sounds like a perfect afternoon

Get rid of the ""new profile"".. 
They will wonder why? Did you have other profiles? Why a new one?

And self development? Everyone is doing that these days. 

You have multiple BA'S... Get creative, get a little silly, make them know you aren't so serious and totally into trying to look perfect.

Hope this helps... good luck!",2022-12-19 05:38:14
Comment,1,j0stolz,,0,1671421094.0,Lmao,2022-12-19 05:38:14
Comment,1,j0stnwj,,0,1671421084.0,Well. Read it again with demons: still weird,2022-12-19 05:38:04
Comment,1,j0stnri,,0,1671421083.0,"Ironically, OP’s punctuation isn’t any better.",2022-12-19 05:38:03
Comment,1,j0stmym,,0,1671421071.0,Did you match?,2022-12-19 05:37:51
Comment,1,j0stmas,,0,1671421062.0,Who's we?,2022-12-19 05:37:42
Comment,1,j0stl92,,0,1671421048.0,"Nah man, i don't think so. I think she's just a dumb girl that adds laughs to texts for no reason. I come across a lot of girls like that, they think it's cute. If she was talking shit, it would've been direct.",2022-12-19 05:37:28
Comment,1,j0stktw,,0,1671421042.0,It’s a low IQ version of Who’s on First?,2022-12-19 05:37:22
Comment,1,j0stjpa,,0,1671421026.0,"I’m glad I’m in a committed relationship and I’ve never used tinder but I’ve seen this sub on popular often and one thing I’ve noticed is that people will put in a lot of mental effort to be as generous as possible with what a woman says, so she’s always just being curious, or joking around; but will also try to have extremely little generosity with what a man says, so anything will be interpreted as some sort of red flag or personality issue. Then there’s immediately incel insults and the accusation of being a fedora wearing redditor towards whoever the man is in the situation. It’s just bizarre",2022-12-19 05:37:06
Comment,1,j0stiyd,,0,1671421015.0,I agree he wouldn’t talk to me at all in conversation and just kept talking about wanting to see all of my tattoos…. 🤦‍♀️,2022-12-19 05:36:55
Comment,1,j0stiwl,,0,1671421015.0,I’m hiring actually! Just send me an example video and I’ll call you back!,2022-12-19 05:36:55
Comment,1,j0stinh,,0,1671421011.0,She's keeping it well hidden,2022-12-19 05:36:51
Comment,1,j0sthb5,,0,1671420992.0,"""you look like an ex I used to beat""",2022-12-19 05:36:32
Comment,1,j0sth8d,,0,1671420991.0,"You said lol, why are you mocking their comment!?!!!",2022-12-19 05:36:31
Comment,1,j0sth62,,0,1671420990.0,">Which answer do you want, dirty or not?

Robert: Jim, would you prefer a nature metaphor or a sexual metaphor?

Jim: Oh, god, nature, please. 

Robert: When two animals are having sex, one of them… 

Jim: *nose exhales*

Robert: … is communicating a message to the other. Nothing is mutua– this isn’t very helpful. You’re gonna want to hear the sexual metaphor.",2022-12-19 05:36:30
Comment,1,j0stgwv,,0,1671420987.0,"Nah it’s just Toronto is very competitive.

There are lots of rich hot dudes there.",2022-12-19 05:36:27
Comment,1,j0stgfz,,0,1671420980.0,Ask her what she did to deserve it.  😂,2022-12-19 05:36:20
Comment,1,j0stg02,,0,1671420974.0,"A small town pastime is jumping off of bridges for fun, not for suicide. It's fun, you should try it!",2022-12-19 05:36:14
Comment,1,j0stf8j,,0,1671420964.0,Sizzling hot lmao.,2022-12-19 05:36:04
Comment,1,j0stcqg,,0,1671420928.0,"“Yeah, I’d hit that too”",2022-12-19 05:35:28
Comment,1,j0stc6e,,0,1671420920.0,Hypergamy,2022-12-19 05:35:20
Comment,1,j0stbcb,,0,1671420909.0,Id guess your wife isnt past dating apps,2022-12-19 05:35:09
Comment,1,j0stb1a,,0,1671420904.0,"""like in a sexy consensual way?""",2022-12-19 05:35:04
Comment,1,j0stawa,,0,1671420902.0,My buddy did seahorse etymologist,2022-12-19 05:35:02
Comment,1,j0staqj,,0,1671420900.0,Wasnt making fun. I was literally stating a fact. My phot was candid of me turning my head when a homeless (seemingly crack addicted gentleman) starting screaming and yelling at a non moving parked car,2022-12-19 05:35:00
Comment,1,j0sta07,,0,1671420890.0,"The phrasing could be better. ""Wtf"" and ""lol"" sounds a bit condescending.",2022-12-19 05:34:50
Comment,1,j0st8wc,,0,1671420874.0,"Nah, people that actually have normal causal conversations with people over text would get it",2022-12-19 05:34:34
Comment,1,j0st8fp,,0,1671420867.0,What would I be butthurt about lol. Im just telling you the tone of her text is obviously belittling.,2022-12-19 05:34:27
Comment,1,j0st8do,,0,1671420867.0,The forbidden fruit!,2022-12-19 05:34:27
Comment,1,j0st84x,,0,1671420863.0,"she a loser, I'm an engineer and I take pictures WITH bridges. then girls like her wonder why they can't find a good one.",2022-12-19 05:34:23
Comment,1,j0st74v,,0,1671420850.0,I read lemons instead of lemme 😂,2022-12-19 05:34:10
Comment,1,j0st6w9,,0,1671420846.0,Frankly 90% of the population would be better off seeing one. We all have trauma from one thing or another.,2022-12-19 05:34:06
Comment,1,j0st4tg,,0,1671420818.0,That's because the devil is in the details 😉,2022-12-19 05:33:38
Comment,1,j0st3jl,,0,1671420800.0,![gif](giphy|l0HlEMf3CdWiETeGk),2022-12-19 05:33:20
Comment,1,j0st3h6,,0,1671420799.0,"Just as a general rule of thumb, making fun of the plight of the disadvantaged isn't really a great way to get new people on your side. But idk, you do you I guess",2022-12-19 05:33:19
Comment,1,j0st1zc,,0,1671420778.0,...meat,2022-12-19 05:32:58
Comment,1,j0st0b2,,0,1671420755.0,“I’m actually the next boyfriend that fucks you well.”,2022-12-19 05:32:35
Comment,1,j0ssybd,,0,1671420726.0,"Mario kart, perchance",2022-12-19 05:32:06
Comment,1,j0ssxt3,,0,1671420719.0,Round two: FIGHT!,2022-12-19 05:31:59
Comment,1,j0sswxv,,0,1671420707.0,Lmaooo I actually lol'd. This is either so weird or you got such a great sense of humor. Idk how much luck you'll get getting serious likes but this is TOP Tier memeing 👏👏,2022-12-19 05:31:47
Comment,1,j0sswvh,,0,1671420706.0,"Chin up guy, just means you arent trash",2022-12-19 05:31:46
Comment,1,j0ssvno,,0,1671420689.0,I had such a good time reading this. Thank you.,2022-12-19 05:31:29
Comment,1,j0ssvmq,,0,1671420689.0,She was attempting to engage with your interests and didn't quite know how. You told her to fuck off. You're the dick in this situation,2022-12-19 05:31:29
Comment,1,j0ssvmb,,0,1671420688.0,GOLD 🤣🤣,2022-12-19 05:31:28
Comment,1,j0ssvdc,,0,1671420685.0,She did ask a specific question tho. If he just would’ve dropped an interesting fact about bridges right there it could’ve been a nice conversation opener. If she would’ve not responded well to this then he could’ve just unmatched her,2022-12-19 05:31:25
Comment,1,j0ssv1d,,0,1671420680.0,"i mean, if you want to spend the rest of your life with someone who says ""wtf"" everytime she sees something mildly offbeat, then I guess you could entertain this",2022-12-19 05:31:20
Comment,1,j0ssurz,,0,1671420676.0,"Okay, but why bridges?",2022-12-19 05:31:16
Comment,1,j0ssu3i,,0,1671420667.0,I think he was just a scammer. 🤦‍♀️,2022-12-19 05:31:07
Comment,1,j0sstkd,,0,1671420660.0,Still wondering why you’re not naked.,2022-12-19 05:31:00
Comment,1,j0ssslw,,0,1671420645.0,My turn😈,2022-12-19 05:30:45
Comment,1,j0sspq4,,0,1671420604.0,"It's not mocking; she thinks he's making a joke. Like a person who climbs or mountaineers or is a geologist writing ""I like rocks"". She's laughing at the joke of making his hobby sound like a non-hobby. Of omitting relevant context to sound quirky or silly. 

""She got what she deserved"" Jesus Christ some of yall are on edge",2022-12-19 05:30:04
Comment,1,j0ssp7j,,0,1671420598.0,"It's sad that guys think this is impressive. Come on, we have to raise the bar We have to become better",2022-12-19 05:29:58
Comment,1,j0ssntz,,0,1671420578.0,Then I’ll beat the sense right into you,2022-12-19 05:29:38
Comment,1,j0ssm6r,,0,1671420555.0,"Haha look at my awesome conversational skills, let me show it off to Reddit what a bellend I am",2022-12-19 05:29:15
Comment,1,j0sslw8,,0,1671420551.0,"I don't like her comment about people only being nice at the end of the year. Negativity right out of the gate is a turnoff too, Janet.",2022-12-19 05:29:11
Comment,1,j0ssk6y,,0,1671420527.0,And then she'd probably tell him because gentle ribbing is a good way to determine someone's sense of humor. OP clearly has zero. Some people are so fucking sensitive it's maddening.,2022-12-19 05:28:47
Comment,1,j0sshlz,,0,1671420490.0,"Hello fellow humans. This Tinder profile is quite extraordinary! With nimble toes like hers, she could cover a lot of ground & go on so many dates.",2022-12-19 05:28:10
Comment,1,j0ssgzx,,0,1671420481.0,It worked out man!!! Those comments above were killing me though but it worked out 😭,2022-12-19 05:28:01
Comment,1,j0ssg72,,0,1671420471.0,?,2022-12-19 05:27:51
Comment,1,j0ssg0u,,0,1671420468.0,You desperately need to work on your game otherwise you'll never lose your virginity.,2022-12-19 05:27:48
Comment,1,j0ssfb9,,0,1671420458.0,Would have been funny if a girl said this to me tbh,2022-12-19 05:27:38
Comment,1,j0ssf97,,0,1671420457.0,it's a perfectly cromulent word,2022-12-19 05:27:37
Comment,1,j0ssf0w,,0,1671420454.0,"Never smoked, had a drink, or did drugs but I have the opposite problem. I look like I'm 28 when I'm really 19. I've gotten into clubs without being carded a couple times before and never once had a single person bat an eye",2022-12-19 05:27:34
Comment,1,j0ssevn,,0,1671420452.0,"Guys, I think he got defensive because she said ""hahaha wtf"" to an obviously big interest of his, not because she asked why. its not that hard to be polite and keep from judging how other people spend their time.",2022-12-19 05:27:32
Comment,1,j0ssdm0,,0,1671420434.0,"I assume it was meant to be a bit jokey.

Technically, it's the same result; you were standing on a bridge and now you're falling rapidly towards Earth.",2022-12-19 05:27:14
Comment,1,j0ssc2s,,0,1671420413.0,"Dude replied to a ton of comments with weird stuff, I think he's too high to stop typing.",2022-12-19 05:26:53
Comment,1,j0ssbsz,,0,1671420409.0,"What else does it mean? Nothing, as far as I know. The Golden Gate Bridge is the most popular place to commit suicide. Not just the most popular bridge, but *place*.",2022-12-19 05:26:49
Comment,1,j0ssbkh,,0,1671420405.0,😂,2022-12-19 05:26:45
Comment,1,j0ssaoj,,0,1671420393.0,Hell yeah Glad it worked out,2022-12-19 05:26:33
Comment,1,j0ss8ds,,0,1671420360.0,"i mean, opening with “wtf” is pretty lame ngl

furthermore, today’s society is so twisted up in negative mental health praising and that is incredibly toxic. so if anyone is saying that is an appropriate way to come on to someone, that’s disgusting imo. i wouldn’t have appreciated the question either. 

sure, she made the minimum effort required to initiate a conversation, and yeah he should have just unmatched instead of the nasty response, but this comment section appears to be applauding for a woman approaching a man with the bare minimum, not exactly opening a fantastic good impression, and you all wonder why all the men you date are shitty men and all the women you date are bitches

the bar is on the floor regardless of how you identify. all of y’all should do better

btw trusses are sexy af",2022-12-19 05:26:00
Comment,1,j0ss7yg,,0,1671420353.0,Politely ask if it was consensual,2022-12-19 05:25:53
Comment,1,j0ss7bp,,0,1671420344.0,that’s crazy i hate rocks,2022-12-19 05:25:44
Comment,1,j0ss5vf,,0,1671420324.0,"“Remember, the safeword is ‘Banana’.”",2022-12-19 05:25:24
Comment,1,j0ss4zg,,0,1671420311.0,"It's the way she asked. Someone you don't know decides to talk like their your best friend, then they can get fucked.",2022-12-19 05:25:11
Comment,1,j0ss4ig,,0,1671420305.0,"Astrid looks nice. Trim her nails, though",2022-12-19 05:25:05
Comment,1,j0ss3sk,,0,1671420295.0,"As most of us can. I once had 20 or 21 likes and the curiosity got the better of me. Big mistake.

It was like a collection of slideshows from sea world",2022-12-19 05:24:55
Comment,1,j0ss3rm,,0,1671420294.0,"I don’t agree with the guy fully but I can see where he’s coming from, beautiful women will ALWAYS have an easier life compared to ugly women or men in general, a women’s beauty can literally make her earns millions or marry a man who earns far more. I dont think women are only restrained based on their beauty, I think it’s based more off of their empathy and caring nature, women are far more emotionally intelligent than men, and them using that strength is very important. Men have generally been providers cause of the way they are built, I work as an engineer and trust me when I say the hardest working people that wake up at like 2am and work till 4am are men. I think it’s important to have a balance because men and women have their strengths and weaknesses, feel free to agree or disagree cause I think open discourse is important for forming opinions.",2022-12-19 05:24:54
Comment,1,j0ss3ra,,0,1671420294.0,Did she have a surgery?,2022-12-19 05:24:54
Comment,1,j0ss33e,,0,1671420285.0,4 and 8 seem gay,2022-12-19 05:24:45
Comment,1,j0ss2xi,,0,1671420282.0,She drinks aged wine🍷😂,2022-12-19 05:24:42
Comment,1,j0ss26o,,0,1671420271.0,This smells like a huge scam. I’ve never heard of an MP that was an officer.,2022-12-19 05:24:31
Comment,1,j0ss202,,0,1671420269.0,"Thought it was pretty clear. Ask for a hook up, you'll get cut up",2022-12-19 05:24:29
Comment,1,j0ss05q,,0,1671420243.0,"Gimme your clothes, your boots, and your motorcycle.",2022-12-19 05:24:03
Comment,1,j0ss01b,,0,1671420241.0,Hahaha wow,2022-12-19 05:24:01
Comment,1,j0srzjr,,0,1671420234.0,"
>did I mess up?

Yeah, percentages simply don't add up like that.

Even pure water is not 130% water.",2022-12-19 05:23:54
Comment,1,j0srzam,,0,1671420230.0,"She will reply with something like ""beat my box"" or my personal favorite, ""beat my guts.""",2022-12-19 05:23:50
Comment,1,j0srz6a,,0,1671420228.0,This was painful man 🤦‍♂️,2022-12-19 05:23:48
Comment,1,j0srxpw,,0,1671420208.0,"""I like rocks""

""Hahaha wtf. Rocks??"" 

""Yeah what about it""

""Well like do you like climbing up them and jumping off them or do you like collecting them"" 

""I'd rather jump off a cliff than talk to you""",2022-12-19 05:23:28
Comment,1,j0srxlw,,0,1671420206.0,Agreed. Crouching like that and on her toes. She could be easily knocked over,2022-12-19 05:23:26
Comment,1,j0srxit,,0,1671420205.0,Give us an update,2022-12-19 05:23:25
Comment,1,j0srx9l,,0,1671420201.0,"Cat, bar and time cover are my least favorite.",2022-12-19 05:23:21
Comment,1,j0srv6z,,0,1671420172.0,"The correct answer is “Cool, then I should apologize and we can have makeup sex right?”",2022-12-19 05:22:52
Comment,1,j0srsmn,,0,1671420135.0,Lol what,2022-12-19 05:22:15
Comment,1,j0srs6t,,0,1671420129.0,She came today and we cuddled and had deep talk all day!,2022-12-19 05:22:09
Comment,1,j0srpob,,0,1671420095.0,wtf you like rocks you mean like how they look or bashing peoples heads in with them?,2022-12-19 05:21:35
Comment,1,j0srp5b,,0,1671420087.0,“Did you like it though?”,2022-12-19 05:21:27
Comment,1,j0srnyd,,0,1671420071.0,None of my friends did it so I didn't do it either,2022-12-19 05:21:11
Comment,1,j0srnvp,,0,1671420069.0,Lolololol,2022-12-19 05:21:09
Comment,1,j0srnrc,,0,1671420068.0,Oh she most certainly did by expanding the topic. Of course she's going to WTF a vague interest of bridges. Wouldn't you? You're just a butt hurt as OP and it didn't even happen to you,2022-12-19 05:21:08
Comment,1,j0srmzh,,0,1671420057.0,"I wouldn’t say most… some, sure. But not most.",2022-12-19 05:20:57
Comment,1,j0srmt8,,0,1671420055.0,Too bubbly. Go darker.,2022-12-19 05:20:55
Comment,1,j0srmfu,,0,1671420050.0,Leave the police officer part out and just put I'm in the army.  Give vague details in general to leave room for conversation.  They eventually get tired of talking about their self.  Your welcome bro.  Go at them with confidence.  You got the height.  Your in solid shape to do well.  Don't talk to them too long before trying to get some sort of date good luck bro you won't need it,2022-12-19 05:20:50
Comment,1,j0srlaw,,0,1671420034.0,You look like an Ex that used to let me love you,2022-12-19 05:20:34
Comment,1,j0srkjp,,0,1671420024.0,Why so cynical,2022-12-19 05:20:24
Comment,1,j0srk72,,0,1671420019.0,Why?,2022-12-19 05:20:19
Comment,1,j0srj6u,,0,1671420005.0, But then... oh HOHO then. Then no more unless she asks for them.,2022-12-19 05:20:05
Comment,1,j0srj0x,,0,1671420003.0,"“Well, is that a good thing?”

Her response will tell you what you need to know",2022-12-19 05:20:03
Comment,1,j0srhpx,,0,1671419985.0,if shes still bringing up her ex id say unmatch even if its just a joke might aswell save ur time man😂,2022-12-19 05:19:45
Comment,1,j0srg4l,,0,1671419964.0,"Haha thanks, it really is awful 🙈 one thing that keeps me working at it though is the opportunity to meet people in other places that I wouldn’t ordinarily run into at the coffee shop down the street. I was lucky enough to meet my ex organically but I don’t think I’m gonna be lucky enough to bump into the perfect guy at H‑E‑B (you never know though! 🤞😅). That’s sweet, what a cool way to meet your wife 🛶 hope you guys enjoy the holidays together! 🎉🎄",2022-12-19 05:19:24
Comment,1,j0srg15,,0,1671419962.0,The pepper spray has been deployed,2022-12-19 05:19:22
Comment,1,j0srej5,,0,1671419941.0,"I can't believe how many people are shitting on OP.  She was totally fucking rude and clearly thought what he was into was stupid to the point of writing HAHAHA and LOL.  What the fuck. Also, I wouldn't want to date anyone who can't even conceive of why someone might be into bridges.  


Now, if she said ""Bridges, eh?  Why's that?""  


That's fine...but LOL WFT HAHAH...?  


Yeah, come on.",2022-12-19 05:19:01
Comment,1,j0srebf,,0,1671419939.0,Dude someone told me that but AFTER A TINDER DATE 😂😂😂,2022-12-19 05:18:59
Comment,1,j0sre5s,,0,1671419936.0,"Don't look away, smile, reduce selfies,",2022-12-19 05:18:56
Comment,0,j0srcgy,,0,1671419912.0,She isn’t showing interest she just wants to continue mocking his interest.,2022-12-19 05:18:32
Comment,1,j0srcfd,,0,1671419911.0,10/10 strategy I can respect that.  Homie knows what works quick,2022-12-19 05:18:31
Comment,1,j0srb0l,,0,1671419891.0,They haven't woofed me yet 🤔,2022-12-19 05:18:11
Comment,1,j0sra0y,,0,1671419877.0,"Lol idk how people
Even get stuck on this shit",2022-12-19 05:17:57
Comment,33,j0sr9u6,,0,1671419874.0,"Damn Jackie, I can’t control the weather.",2022-12-19 05:17:54
Comment,2,j0sr9ol,,0,1671419872.0,If you’re not getting matches then the app is completely broken and shouldn’t even be installed.,2022-12-19 05:17:52
Comment,1,j0sr8o0,,0,1671419858.0,"You can't be into Bridge Engineering? Architecture?.. all can be done in a small to scale models.

Do yea you can definitely do the same with a bridge ffs.",2022-12-19 05:17:38
Comment,1,j0sr86p,,0,1671419851.0,"Reddit confuses me! I'm not looking to date on this app, how do I get to leave comments?",2022-12-19 05:17:31
Comment,1,j0sr7hl,,0,1671419841.0,Poor guy I hope he finds someone,2022-12-19 05:17:21
Comment,0,j0sr6xh,,0,1671419834.0,"Their clarification makes it so much better /s 

Seriously though I’m glad you didn’t have to waste much time to figure out that they weren’t worth it",2022-12-19 05:17:14
Comment,1,j0sr6vp,,0,1671419833.0,"I won't argue that, but im not wrong here",2022-12-19 05:17:13
Comment,1,j0sr6t6,,0,1671419832.0,The lid on that pressure cooker clearly doesn't stay latched well. 10/10 solution,2022-12-19 05:17:12
Comment,1,j0sr67x,,0,1671419824.0,“Who the fuck starts a conversation that way? I just sat down!”,2022-12-19 05:17:04
Comment,1,j0sr5ix,,0,1671419814.0,The shitty thing about texting is the number of different ways people interpret things. It’s my least favorite form of communication for so many reasons.,2022-12-19 05:16:54
Comment,1,j0sr4he,,0,1671419799.0,So the tattooed part in the center is her right leg? Arms left and right and probably her belly in the top?,2022-12-19 05:16:39
Comment,1,j0sr3cn,,0,1671419783.0,Right? It's hard to be more transparent than nudity.,2022-12-19 05:16:23
Comment,1,j0sr2xt,,0,1671419777.0,Looks like she's doing well after being off heroin for a month ♥️,2022-12-19 05:16:17
Comment,1,j0sr2ey,,0,1671419769.0,I bet he loves the movie Joker and think Quentin Tarantino directed it.,2022-12-19 05:16:09
Comment,0,j0sr1ij,,0,1671419757.0,Actually I was being ironic on purpose. Whooshed 17 people so far i guess,2022-12-19 05:15:57
Comment,1,j0sr128,,0,1671419750.0,She said she was her (Harley Quinn) which is the red skirt costume so she’s on the right.,2022-12-19 05:15:50
Comment,-1,j0sr0w7,,0,1671419748.0,"It’s a lazy way of dating with baggage galore.

Social hobbies or bar hoppers are still solid ways to find people.",2022-12-19 05:15:48
Comment,1,j0sr0um,,0,1671419747.0,Oh i thought he used a live turtle,2022-12-19 05:15:47
Comment,2,j0sqxop,,0,1671419703.0,Owner tries to calm the person down and suddenly has assaulted them without ever even getting within arms reach,2022-12-19 05:15:03
Comment,2,j0sqxo2,,0,1671419702.0,He has no freaking clue.,2022-12-19 05:15:02
Comment,1,j0sqxa6,,0,1671419697.0,Thanks? Idk man. Theres very few good ways out of this,2022-12-19 05:14:57
Comment,1,j0sqwfo,,0,1671419685.0,He a needs to be processing this stuff with a therapist. Chances of meeting a codependent partner who believes that they can help with a trauma of these magnitude is extremely slim.,2022-12-19 05:14:45
Comment,2,j0sqwcl,,0,1671419684.0,but of course. how could I have been so blind?,2022-12-19 05:14:44
Comment,-1,j0sqwbj,,0,1671419683.0,This isn't what she said though?  She laughed and said WTF indicating that it was kind of weird that he found them interesting.,2022-12-19 05:14:43
Comment,1,j0squre,,0,1671419662.0,Nothing I’d just move on,2022-12-19 05:14:22
Comment,1,j0sqtiv,,0,1671419643.0,Nope,2022-12-19 05:14:03
Comment,1,j0sqt77,,0,1671419639.0,"I build bridges for a living. 

Cheers mate, well played.",2022-12-19 05:13:59
Comment,3,j0sqsb9,,0,1671419627.0,People don't pass up scholarships to join the army.,2022-12-19 05:13:47
Comment,2,j0sqs3s,,0,1671419624.0,The animal control service is now on their way.,2022-12-19 05:13:44
Comment,1,j0sqs3k,,0,1671419624.0,Isn't this what life is?,2022-12-19 05:13:44
Comment,1,j0sqrh1,,0,1671419615.0,"Nah- you had boundaries and they seemed to stomp all over them, which is a red flag in itself",2022-12-19 05:13:35
Comment,2,j0sqr8l,,0,1671419611.0,"Op is hella attractive 

Sure his profile could be tweaked a bit, but how is he getting no matches? Op looks like a model",2022-12-19 05:13:31
Comment,1,j0sqq4y,,0,1671419595.0,I eat ass.,2022-12-19 05:13:15
Comment,0,j0sqq1v,,0,1671419594.0,"I've been married nearly 20 years - I'm long past dating apps unless I want a divorce. 

I'm kinda glad I don't have to deal with this shit.",2022-12-19 05:13:14
Comment,1,j0sqprr,,0,1671419590.0,Short kings we up🤝,2022-12-19 05:13:10
Comment,1,j0sqppl,,0,1671419589.0,Nice,2022-12-19 05:13:09
Comment,1,j0sqpbf,,0,1671419583.0,She was asking to make fun of him more are you for real?,2022-12-19 05:13:03
Comment,1,j0sqoz4,,0,1671419579.0,That was too easy.  Basically ask for her number right away,2022-12-19 05:12:59
Comment,1,j0sqosa,,0,1671419576.0,"Right? This guysl had one on the line, pulled out a knife, cut the taut line then ask why he is left with nothing.",2022-12-19 05:12:56
Comment,1,j0sqora,,0,1671419576.0,I've already been there so I can move on.,2022-12-19 05:12:56
