title,score,id,url,comms_num,created,body,timestamp
Quite the opener,4,zphc1f,https://i.redd.it/r16iiif3lt6a1.jpg,0,1671422455.0,,2022-12-19 06:00:55
What do I reply to this? i feel this conversation is getting boring.,3,zphasi,https://i.redd.it/6ibxax3vkt6a1.jpg,2,1671422376.0,,2022-12-19 05:59:36
"Girl asked in her profile for my favorite color, favorite animal, and favorite form of water. My response vs. hers may be a red flag.",0,zph5sn,https://i.redd.it/jy8gxxaljt6a1.jpg,8,1671421949.0,,2022-12-19 05:52:29
"What girls do I swipe right on, on tinder???",1,zph555,https://www.reddit.com/r/Tinder/comments/zph555/what_girls_do_i_swipe_right_on_on_tinder/,3,1671421897.0,"Should I just auto swipe left if a girl just has insta-handle or no bio? What girls will actually meet up?

What if there’s no info but insta is linked?

I don’t wanna waste time or swipes",2022-12-19 05:51:37
hopefully she's not a hitman,5,zpgtgf,https://i.redd.it/vwubnqijgt6a1.png,0,1671420923.0,,2022-12-19 05:35:23
Thought I’d share the line that that got my girlfriend and I started. We recently adopted a kitten that I didn’t really want but it’s growing on me,16,zpgdzy,https://www.reddit.com/gallery/zpgdzy,5,1671419661.0,,2022-12-19 05:14:21
Hello and goodbye,0,zpgarp,https://i.redd.it/u9ru81ozbt6a1.jpg,5,1671419393.0,,2022-12-19 05:09:53
Wait what,10,zpfwto,https://i.redd.it/fafiyi1p8t6a1.jpg,3,1671418286.0,,2022-12-19 04:51:26
Don't know how to follow up on a good opener aaaaa,2,zpfmq9,https://www.reddit.com/r/Tinder/comments/zpfmq9/dont_know_how_to_follow_up_on_a_good_opener_aaaaa/,6,1671417486.0,"Well, I say good, but like, I started out by asking ""do you often sit on Tinder at 3am or am I just lucky?"" to which she responded ""you're quite lucky haha"" (it's my best start so far, ok)

So I see a very easy segue into like idk, asking for something, like ""lucky enough to get coffee with you?"" or something to that degree, but 

1) I haven't been on this app for very long, 

2) I have pretty bad social skills in general

So in conclusion I am completely unsure if this would be fitting as the literal second thing I say to her. Any ideas? We basically have nothing in common that I can see, but she is kinda cute.

Edit: I replied ""then I'll just have to hope to keep up the good luck :P"" and she replied ""haha sweet"" which seems good xD",2022-12-19 04:38:06
I smoke daily and I love weed but this bio is so cringey. Am I being too harsh? I just find this kinda off putting and I get secondhand embarrassment from it.,4,zpfjj2,https://i.redd.it/vrfw1u2k5t6a1.jpg,10,1671417230.0,,2022-12-19 04:33:50
Thought I’d check out Facebook dating…,6,zpf86g,https://i.redd.it/ji77l6jw2t6a1.jpg,12,1671416337.0,,2022-12-19 04:18:57
"Girl I’ve been talking with and seeing for 2 months randomly unadds me off of everything, do i text her and ask?",1,zpezry,https://www.reddit.com/r/Tinder/comments/zpezry/girl_ive_been_talking_with_and_seeing_for_2/,3,1671415679.0,"I (22M) was talking to this girl (22F) for about 2 months. We really hit it off and talked all the time for the entire two months. 

We’re both college athletes so it was hard to see each other but once our seasons ended we hung out, it went good and i enjoy being around her and she said the same. 

Strangely like a week after that she got distant and started not replying as often, i asked. She said she thought i didn’t enjoy hanging out and didn’t wanna be “annoying”. i corrected her and things went back to normal. 

Then again a week later she got distant again. I decided to ask her something, and for some background, a couple guys i know at her college i asked their opinion about her and they both said that she has a “man” and i knew this before we hung out but wasn’t going to bring it up. So i asked her, she obviously said No i don’t have a man or anything like that. 

Fast forward like 2 weeks later we’re in the middle of conversation over snapchat and she just unadds me out of no where. 

It’s been like a week and I was upset and confused but i just left it at that. Do i text her asking what happened and why?",2022-12-19 04:07:59
"In the Toronto area, been having no matches. It's been 2 weeks now, and 17 likes are in the queue. I used to have super good matches on Tinder few years ago. I think this app has just gone downhill with all the capitalization switch",2,zpekkh,https://www.reddit.com/gallery/zpekkh,24,1671414442.0,,2022-12-19 03:47:22
Literally the dumbest question he could’ve asked,0,zpekdg,https://i.redd.it/duju3j18xs6a1.jpg,3,1671414426.0,,2022-12-19 03:47:06
I scored the W bois,12,zpefyb,https://www.reddit.com/gallery/zpefyb,14,1671414057.0,,2022-12-19 03:40:57
Just made an account and been banned?,4,zpeck1,https://www.reddit.com/r/Tinder/comments/zpeck1/just_made_an_account_and_been_banned/,5,1671413776.0,"(20F)

I have two photos on my profile, I haven't even messaged anyone or got any proper matches yet and I've had my account for less than 24 hours. I'm confused as to why I've been banned. My only guess is that I have NordVPN and my IP kept changing and being weird due to it but overall I'm a little confused (I turned it off when I was using tinder).

I didn't message anyone; all I've done is swipe left and right. 

Is there anything I can do to appeal this? Or do I just have to accept my fate as not being able to use the app?",2022-12-19 03:36:16
Last year I emotionally invested with a man I met on Tinder,11,zpe8y6,https://www.reddit.com/r/Tinder/comments/zpe8y6/last_year_i_emotionally_invested_with_a_man_i_met/,7,1671413486.0,"Turned out, he just wanted to sweet talk to me into investing in crypto.
Tell me a time you found way too late that they were not intrested in you and just wanted to use you.",2022-12-19 03:31:26
"Oh, the irony!",6,zpe5xm,https://i.redd.it/svaadtlpts6a1.jpg,2,1671413245.0,,2022-12-19 03:27:25
Why aren't my lines ever working? Getting really demotivated.,1,zpduj7,https://imgur.com/eIYZO2n.jpg,3,1671412305.0,,2022-12-19 03:11:45
Honest feedback please,2,zpdo68,https://i.redd.it/q7v8825eps6a1.jpg,4,1671411794.0,,2022-12-19 03:03:14
"This one goes out to my short kings! Although, I’d argue she need better friends 🤷🏻‍♂️",34,zpdcs1,https://i.redd.it/enagl8bpms6a1.jpg,4,1671410888.0,,2022-12-19 02:48:08
Tinder swiping stats for a 20 yo male,9,zpchnf,https://i.redd.it/froo09yyxq6a1.png,4,1671408471.0,,2022-12-19 02:07:51
A true gentleman,11,zpcaxg,https://i.redd.it/8h691mg2es6a1.jpg,12,1671407984.0,,2022-12-19 01:59:44
Easiest swipe right.,80,zpc8p4,https://i.redd.it/u15sutzids6a1.jpg,6,1671407803.0,,2022-12-19 01:56:43
Rate my bio,2,zpbnhb,https://i.redd.it/4mwq8drn8s6a1.jpg,2,1671406166.0,,2022-12-19 01:29:26
He was not joking....,80,zpbehf,https://i.redd.it/aveqzdjm6s6a1.png,45,1671405482.0,,2022-12-19 01:18:02
Rate this top gun line,0,zpb022,https://i.redd.it/j79xtdog3s6a1.jpg,40,1671404418.0,"For reference I'm a pilot and on my profile I have a pic of my in a flying suit with aviators Infront of an F14, think the line works better with that context",2022-12-19 01:00:18
Just give them the same energy back 🤷🏽‍♀️,18,zparg3,https://i.redd.it/2hdq0r2m1s6a1.jpg,22,1671403795.0,,2022-12-19 00:49:55
Openers Men Like,3,zpaoig,https://www.reddit.com/r/Tinder/comments/zpaoig/openers_men_like/,9,1671403570.0,"As a very independent 22F who is genuinely looking for love , I like putting the effort in & messaging first . Most of the time I go through their profiles & come up with something personal .. but other times I want to go with a terrible pickup line that gives off good humour , but also no ‘pick me’ or ‘just f**k me’ vibes . 

So I’m here asking y’all , what are the best openers / pickup lines that you’ve heard from women ?!?",2022-12-19 00:46:10
How many thousands of times have you seen this on someone’s profile,12,zpak35,https://i.redd.it/7xzhiwiyzr6a1.jpg,3,1671403240.0,,2022-12-19 00:40:40
The sweat nasties 🥵,5,zpahyp,https://i.redd.it/r07s4kohzr6a1.jpg,2,1671403083.0,,2022-12-19 00:38:03
newbie? maybe...,3,zpadhv,https://www.reddit.com/r/Tinder/comments/zpadhv/newbie_maybe/,10,1671402755.0,Tempted to join but I'm 51 F and not sure if it's the right site.  Not looking for anything serious but i don't want some peckerhead either.  Thoughts?,2022-12-19 00:32:35
even though this didn't end up going anywhere.... I believe it was the best compliment I have ever received.!!,17,zp9z96,https://i.redd.it/cll5ur7bvr6a1.jpg,8,1671401676.0,,2022-12-19 00:14:36
Marissa proclaimed a love of Taco Bell,9,zp9pek,https://i.redd.it/w0756345tr6a1.jpg,8,1671400946.0,,2022-12-19 00:02:26
"sir, are you okay?",18,zp91nd,https://i.redd.it/q2viiw21or6a1.jpg,4,1671399227.0,,2022-12-18 23:33:47
"Guys, I am not getting any dates off tinder - any thoughts/recommendations on my openers?",0,zp9143,https://i.redd.it/gzf652uwnr6a1.jpg,25,1671399188.0,,2022-12-18 23:33:08
Tinder app ignores my settings.,3,zp8upj,https://www.reddit.com/r/Tinder/comments/zp8upj/tinder_app_ignores_my_settings/,6,1671398722.0,"Did anyone else find that the app suggests people from time to time that are:

- no where near you selected range (I selected to only see people on 12km radius). However the app sometimes adds few people who are 400-600km away from me! (Wtf)

- gives me guys from time to time (despite me setting up my search as being straight male and “show me woman” as my only criteria.

Does anyone else get this?

P.s- why does app think I would be interested in someone who is 2 countries away from me or same sex 😂",2022-12-18 23:25:22
Pancakes,417,zp8txv,https://i.redd.it/e0qw3updmr6a1.png,16,1671398673.0,,2022-12-18 23:24:33
Oops,11,zp8tnn,https://www.reddit.com/gallery/zp8tnn,9,1671398652.0,,2022-12-18 23:24:12
Group pics PSA,1,zp7uhd,https://www.reddit.com/r/Tinder/comments/zp7uhd/group_pics_psa/,3,1671396115.0,"Women - if your profile contains nothing but group pics, make sure you’re the most attractive person in each one. Otherwise you’re either catfishing or lack any confidence. Both are unattractive.",2022-12-18 22:41:55
"In the British Army, we always try to convince girls we do weird jobs, like a dolphin waxer.",759,zp7nvd,https://i.imgur.com/a7IBOUv.jpg,48,1671395624.0,,2022-12-18 22:33:44
TMI for a dating profile?,55,zp7m1r,https://i.redd.it/vatw4g2xcr6a1.jpg,65,1671395491.0,How do you even approach this one…? I was going to suggest he smile based on his photos. Now I know why he doesn’t. Holy moly!,2022-12-18 22:31:31
How the hell do I respond to that (yes that does say Hitler under the X),24,zp7a2x,https://i.redd.it/cgm1062dar6a1.jpg,20,1671394632.0,,2022-12-18 22:17:12
my white knight,77,zp6sbg,https://i.redd.it/3ta1s39l6r6a1.png,10,1671393363.0,,2022-12-18 21:56:03
did I mess up?,42,zp6qci,https://i.redd.it/ftvdc9w56r6a1.png,25,1671393219.0,,2022-12-18 21:53:39
Wish me luck boys,549,zp6pci,https://i.imgur.com/I02pKDd.jpg,16,1671393141.0,,2022-12-18 21:52:21
"M19, not having much luck, can I have some advice on pictures/picture order?",0,zp6ipr,https://i.redd.it/1lsmhd0i4r6a1.jpg,21,1671392660.0,,2022-12-18 21:44:20
Back after a long hiatus. Need some help with my profile. Open to all suggestions and criticism.,0,zp6eby,https://www.reddit.com/gallery/zp6eby,3,1671392334.0,,2022-12-18 21:38:54
People who have liked me not showing on stack,1,zp69gj,https://www.reddit.com/r/Tinder/comments/zp69gj/people_who_have_liked_me_not_showing_on_stack/,3,1671391959.0,"Okay so I’ve basically opened a new Tinder acc 3,4 days ago,and yesterday saw that 3 girls have liked me(they were second on list and the names matched with likes) and I was out of likes so I waited until tomorrow to match with them.
Fast forward to next day,all 3 of them are out of the stack(not showing second or even at all after swiping at all people on 10km distance-they were all around 2,3km away).So Ive even tried raising the distance to max and still swiped a bit and they didn’t show up at all.So my question is is this some kind of a bug or is the app actually restricting me from matching with people who have actually liked me?
Or has this kind of a thing happened to anyone else(Ive had tinder accs before and I believe this hasn’t ever happened to me before)?",2022-12-18 21:32:39
it’s a no from me,5,zp64hq,https://i.redd.it/85bppbqb1r6a1.jpg,1,1671391592.0,,2022-12-18 21:26:32
I matched with someone I know,2,zp5zw6,https://www.reddit.com/r/Tinder/comments/zp5zw6/i_matched_with_someone_i_know/,6,1671391255.0,"As a person I'm quite awkward already and I don't know how to start the conversation without it being awkward, anyone have any advice?

Edit: I don't know her well, in maybe talked to her once or twice is HS and that's about it.",2022-12-18 21:20:55
My friend says i was being bitchy about it. Am i wrong here?,227,zp5ti0,https://i.redd.it/3mq057hwyq6a1.png,94,1671390780.0,,2022-12-18 21:13:00
This dude from tinder fucked up,36,zp5p46,https://www.reddit.com/gallery/zp5p46,26,1671390457.0,He meant to create a private story and instead created a group chat with all his hoes and they’re all done with him,2022-12-18 21:07:37
"Straight men, how many likes do you get?",2,zp5gcr,https://www.reddit.com/r/Tinder/comments/zp5gcr/straight_men_how_many_likes_do_you_get/,5,1671389822.0,"On average, how many likes do you get?

[View Poll](https://www.reddit.com/poll/zp5gcr)",2022-12-18 20:57:02
Drink your milk kids,25,zp5e3d,https://i.redd.it/q4jhr5ljvq6a1.png,5,1671389648.0,,2022-12-18 20:54:08
What do I even say?,3659,zp5b2a,https://i.redd.it/0hwmfakadp6a1.jpg,747,1671389416.0,,2022-12-18 20:50:16
I’ve never had this happen to me lmaoo. She unmatched me after that.,0,zp4xqo,https://i.redd.it/1w79gkusrq6a1.jpg,49,1671388389.0,,2022-12-18 20:33:09
hmmmm,308,zp4ph0,https://i.redd.it/2dclv85e8p6a1.jpg,95,1671387758.0,,2022-12-18 20:22:38
Can I get your guys' opinion on my pics?,2,zp4e3n,https://i.redd.it/0jrmtxmcnq6a1.jpg,13,1671386893.0,,2022-12-18 20:08:13
Max 23 oop😬,0,zp48iz,https://i.redd.it/37moept1mq6a1.jpg,2,1671386459.0,,2022-12-18 20:00:59
"Haven’t been getting matches in weeks, any ideas of improvement?",0,zp3xsb,https://www.reddit.com/gallery/zp3xsb,22,1671385527.0,"Additional info: I’m going with the flow, whether something turns out to be casual or go into something serious, I don’t have a preference.",2022-12-18 19:45:27
"Men under 35, do you have any luck casually dating women in the 35-45 age group? My experience is most of the only want LTR. (Yes, even on Tinder).",2,zp3h0x,https://www.reddit.com/r/Tinder/comments/zp3h0x/men_under_35_do_you_have_any_luck_casually_dating/,11,1671384111.0,"What I’m also picking at is if women are open to casual dating, but just with younger men, (as in, they do differentiate between fun men and commitment men), or if they’re not open to casual at all past a certain age.",2022-12-18 19:21:51
The rare healthy tinder interaction,1980,zp2ts6,https://i.redd.it/4mrikosj9q6a1.jpg,125,1671382252.0,,2022-12-18 18:50:52
I put one of my interests as bridges. She unmatched me obviously.,10785,zp2i27,https://i.redd.it/e00vfqnr6q6a1.jpg,1267,1671381315.0,,2022-12-18 18:35:15
Am I reading too much into this?,6,zp293g,https://www.reddit.com/r/Tinder/comments/zp293g/am_i_reading_too_much_into_this/,16,1671380621.0,"I matched with someone who I’ve been talking to a lot and I feel like we have really good vibes, and similar interests, we also have a date tomorrow. 

Just this morning I noticed she updated her profile with new pictures and added “wont message first” in her bio…

Does this mean she’s not interested anymore? Or am I reading too much into this?",2022-12-18 18:23:41
"this was an accidental swipe but when I saw he messaged me I thought ""maybe I'd be surprised""... It's certainly an interesting first message.",23,zp1xfo,https://i.redd.it/k8ief1r22q6a1.png,10,1671379738.0,,2022-12-18 18:08:58
I shouldn’t have even bothered to meet him,75,zp0wfj,https://i.redd.it/ijvinq9ctp6a1.jpg,17,1671376800.0,"but I did. And he asked me why I have a sling on and then why the photos I have are not with a sling. Apparently, “that’s misleading” of me. 
As he continues on to tell me his, name, age, job, and where he lives is not the same as what he has on his profile and he smokes everyday even though he had non smoker in his profile. But somehow I was the misleading one lol",2022-12-18 17:20:00
Man’s told me to Google him 😭😭,32,zp0u7n,https://i.redd.it/35l64yorsp6a1.jpg,19,1671376608.0,,2022-12-18 17:16:48
Are European Men aging in Dog Years?,4,zp0ruf,https://i.redd.it/6l74t0ooao6a1.jpg,4,1671376419.0,,2022-12-18 17:13:39
Is this fake or are there actually people that act like this?,9,zp0qol,https://i.redd.it/na79ovswrp6a1.jpg,20,1671376319.0,,2022-12-18 17:11:59
Who…is the target audience here?🧐,28,zp09my,https://i.imgur.com/cQqE0RG.jpg,48,1671374960.0,,2022-12-18 16:49:20
did I do okay?,0,zp05vi,https://i.redd.it/bjrsys3ymp6a1.jpg,3,1671374651.0,,2022-12-18 16:44:11
#tinder gone wrong,0,zp0209,https://www.reddit.com/gallery/zp0209,6,1671374340.0,,2022-12-18 16:39:00
Bug Callout - I was matched with someone I've never seen,1,zozmir,https://www.reddit.com/r/Tinder/comments/zozmir/bug_callout_i_was_matched_with_someone_ive_never/,5,1671373072.0,"As summary suggests, latest set of changes done to Tinder (at least in my region of their service) now include an auto-stranger-match feature!  


Specifics:  
I received a notification I'd matched with someone, didn't recognize their very unique name and profile pictures, checked my ""Likes Sent"" list just to be *extra* sure, and had never seen this person before.  


It's hard enough out here getting matches and keeping a conversation with someone I'm genuinely interested in for more than a day without Tinder throwing me the pity random match.  


Happy hunting everyone!",2022-12-18 16:17:52
That's one way to do it.,470,zozge9,https://i.redd.it/hrregp2qgp6a1.jpg,21,1671372558.0,"I swiped right, cos why not.",2022-12-18 16:09:18
what to say back?,6,zozb1e,https://i.redd.it/evmy91befp6a1.jpg,7,1671372110.0,,2022-12-18 16:01:50
Profile verification,1,zoz4gr,https://www.reddit.com/r/Tinder/comments/zoz4gr/profile_verification/,0,1671371599.0,"I can't get my profile to be verified. I mean there's a bug in the process.

When I do the verification process (where you heve to put your face in the circle and get closer), as soon as I quit the app and come back (so, like 10 sec), the green clock (indicating the process is ongoing) is gone and ofc I'm not verified.

Normally, the green clock stays until the process is done then you get a message telling you you're verified or not, and if not you can repeat the process. Now I feel like nothing is done when I post my verification video and I can do it again straight away.

Weirder yet, I've contacted support who tells me I'm already verified. But I'm not, no blue tick on my side.",2022-12-18 15:53:19
"Yep, you’re 29 years old, bet those pictures are too.",2,zoylti,https://i.redd.it/ins1p7k69p6a1.jpg,5,1671370020.0,,2022-12-18 15:27:00
Going ancient 👍🏻,75,zowt8i,https://i.redd.it/4buwnt33ro6a1.png,8,1671363936.0,,2022-12-18 13:45:36
The red flags,172,zowslz,https://www.reddit.com/gallery/zowslz,86,1671363875.0,"The first three are the current conversation and the last two are what I’m talking about. 

The knife thing went on for too long to screenshot but essentially he was saying I should illegally carry a knife at all times for “safety”. And I was saying that’s stupid and im more likely to get injured than an attacker. It’s better to go to a women’s self defence class and learn what to do. But he would just not let it go, saying “Carry a knife. Do it.” 

He’s also been demanding I eat a certain way and exercise a certain way despite me recovering from anorexia and following a meal plan. He’s not a dietician. And I have cardiac issues so I work out very lightly. He knows both of these things. What a red flag",2022-12-18 13:44:35
I'm just not going to bother,11,zowqr6,https://i.redd.it/yl5wxkzaqo6a1.jpg,5,1671363672.0,,2022-12-18 13:41:12
I included the picture because I swear people will just say I'm just salty about not getting matches. But anyone have a bug where people you match and message you immediately disappear from your like list? consistently for years now it's been this way for me and finally wanted to ask why.,0,zowebb,https://i.redd.it/1c6z3mo7mo6a1.jpg,10,1671362297.0,,2022-12-18 13:18:17
Too many matches,0,zoviid,https://www.reddit.com/r/Tinder/comments/zoviid/too_many_matches/,5,1671358854.0,"So I have about 146 matches. It's too many and I suppose my question is is it okay if I went back through and struck up conversations with ""old"" matches. We're talking March 2022 etc. Or would they be all ""why'd it take you so long"" - maybe I should delete and start again? I can't really have conversations with more than 1 or 2 people at a time, that's why I haven't spoken to everyone. ",2022-12-18 12:20:54
let's get to know each other's,26544,zouww6,https://i.redd.it/0q3u10es4o6a1.png,754,1671356437.0,,2022-12-18 11:40:37
btw,12,zouvo5,https://i.redd.it/4ushhoid4o6a1.png,4,1671356297.0,,2022-12-18 11:38:17
I’d be surprised if he gets any matches with that bio,19,zoujbn,https://i.redd.it/wmavi1x50o6a1.jpg,4,1671354881.0,"When opinions are left to their own accord and find themselves on your tinder bio 🫣. Nobody is swiping right on you now, at least you may have had the 20 stone woman to start with. You’ve nobody now!",2022-12-18 11:14:41
How to respond? I asked her out but she dodged my question,2,zou5ji,https://i.redd.it/1ev8ksmqvn6a1.jpg,6,1671353393.0,,2022-12-18 10:49:53
oof,152,zotsjv,https://i.redd.it/ips3c3ggrn6a1.png,13,1671351952.0,,2022-12-18 10:25:52
"Alot of people texting at me and want to meet me irl, what should I do?",2,zotoha,https://www.reddit.com/r/Tinder/comments/zotoha/alot_of_people_texting_at_me_and_want_to_meet_me/,7,1671351531.0,"I'm currently talking with 4 guys right now, going good so far, but 3 of them want to meet irl. 

what if I end up with 1 guy, what should I say to the other? and will it consider cheating if I go on a date with all the 3 guys in difference day?",2022-12-18 10:18:51
I wouldn’t say I was the forward one here,46,zotof2,https://i.redd.it/uhja2yh6qn6a1.jpg,3,1671351525.0,,2022-12-18 10:18:45
A lot to unload here 🥴,19,zotnl9,https://i.redd.it/c55gxlzwpn6a1.jpg,9,1671351435.0,,2022-12-18 10:17:15
Will she sit on my face?,13,zot780,https://i.imgur.com/Qqpdcbw.jpg,4,1671349668.0,Did I screw this up?,2022-12-18 09:47:48
Deleted profile still messaging,0,zos2pa,https://www.reddit.com/r/Tinder/comments/zos2pa/deleted_profile_still_messaging/,2,1671345225.0,"I matched with a guy and the conversation was going well for about a week, but his profile suddenly disappeared and he no longer has a profile photo. There’s no profile to even click on or anything but we are still able to message. This oddity has persisted through a whole day of light messaging. Does anyone have any experience with this happening or know what it means? I haven’t asked him about it yet, because I want to make sure I’m not naive/unaware of some sort of catfish/scam.",2022-12-18 08:33:45
"Yesterday I had no matches. Allow Platinum to expire, and guess what happens?",42,zos2ok,https://i.redd.it/hp80xj5g7n6a1.jpg,18,1671345224.0,"We all know the game is rigged, but they could at least be a bit more discreet about it!",2022-12-18 08:33:44
Holy Matrimony 😂🪑,84,zorokp,https://i.redd.it/d26iqi863n6a1.jpg,7,1671343786.0,,2022-12-18 08:09:46
Seen this on a man’s profile. What even…,16,zoqsmh,https://i.redd.it/f649n1pttm6a1.jpg,14,1671340641.0,,2022-12-18 07:17:21
Protecting Precious Pink Penguin Poop,0,zoqngw,https://www.reddit.com/gallery/zoqngw,15,1671340163.0,,2022-12-18 07:09:23
Cute,4,zoqdb3,https://i.redd.it/i7g3u2aopm6a1.jpg,4,1671339247.0,,2022-12-18 06:54:07
I am unique and quirky,360,zoq9y8,https://i.redd.it/jd8qxnxqom6a1.jpg,45,1671338934.0,,2022-12-18 06:48:54
Why is he charging $1000 per week but only willing to give me $120??? LOL /j,3,zoq1hk,https://www.reddit.com/gallery/zoq1hk,4,1671338147.0,,2022-12-18 06:35:47
What’s the chances…,0,zopq5o,https://www.reddit.com/r/Tinder/comments/zopq5o/whats_the_chances/,8,1671337119.0,New to tinder….what are the chances somebody has “unvaccinated” in their profile by accident? I get the feeling it’s some kind of badge of honor and I don’t want to have THAT discussion.,2022-12-18 06:18:39
"Found this online, flawless.",128,zopmyc,https://i.redd.it/81myya1x0l6a1.jpg,17,1671336826.0,,2022-12-18 06:13:46
as a brat i’m really missing out,3,zopj0z,https://www.reddit.com/gallery/zopj0z,8,1671336490.0,,2022-12-18 06:08:10
"I'm sorry, What?!? Mother to 5??😳 but she not sure if she wants kids yet? someone help explain.",2,zop7zx,https://i.redd.it/f605r64jem6a1.png,19,1671335500.0,,2022-12-18 05:51:40
tinder rizz,0,zonz1a,https://www.reddit.com/gallery/zonz1a,8,1671331581.0,my brother said i should post these here so here i am lol,2022-12-18 04:46:21
Why would he think that bio would get anyone to swipe right??,21,zonoov,https://i.redd.it/9lybglw80m6a1.jpg,4,1671330697.0,,2022-12-18 04:31:37
Wow he must really love avocados,0,zonlvx,https://i.redd.it/gvkpye2kzl6a1.jpg,2,1671330463.0,,2022-12-18 04:27:43
I thought I messed my second date and deleted all my dating apps then this happens! Thank you reddit for giving me advice :),56,zon9d3,https://www.reddit.com/gallery/zon9d3,23,1671329412.0,,2022-12-18 04:10:12
the bar is in hell,115,zon4er,https://i.redd.it/bowg5wo8vl6a1.png,19,1671329011.0,,2022-12-18 04:03:31
