title,score,id,url,comms_num,created,body,timestamp
Weird Date,148,ziqr1b,https://www.reddit.com/r/Tinder/comments/ziqr1b/weird_date/,100,1670763190.0,"About a month ago I (22/F) probably had the most awkward date I've ever had. 
When we matched he (31/M) wasn't 100% my type but he seemed really nice, had lots of pictures doing fun stuff. I'm not huge on looks, I don't need the perfect looking man if he has a good personality.

Talking on the app he seemed like a super interesting person, has archived lots of things in life, did lots of fun things. After texting for a week he asked me on a date, he took a train to my city and we went on a nice brunch date, had amazing talks, laughed a lot and overall it was a great time but Ive noticed really early on that he's just really not my type at all. He insisted on paying for my meal even after me offering and after he suggested that we go get some drinks. He insisted on paying for those as well. We talked a lot and he kept bringing up holidays he went on and that he was going on soon, asked me if I wanted to go on a Europe trip this weekend.

It was super fun but I couldn't imagine going any further then being friends. At the end he tried kissing me and I nervously chuckled and changed subject.

The next day he kept messaging me that we need to go out for another date really soon.
I tried to tell him I wasn't interested but he really didn't budge so after class I agreed to meet for dinner but I told him that its not going to be more than dinner. Dinner was nice, once again he insisted on paying. After he tried to convince me to go to a hotel or my place, he wouldn't take a no for an answer so I gave him and told him to come over to my place in hope he would leave earlier then if we went to a hotel. 
Walking through the door he told me ""A thank you for paying for your food is definitely not enough, you should pay me in kisses"" and thats when all the last bit of interest was gone. I told him that I'm not going to do this. He stormed out of my apartment like a sulking little kid. A few hours later I got a message saying I should pay him back all the money he ""wasted"" on me. 

Man was bragging about all the money he had, would not let me pay but when he didn't get what he wanted he got mad like a little kid...",2022-12-11 14:53:10
the never ending cesspool ended....!,1517,zipdh7,https://i.redd.it/440lxectva5a1.jpg,191,1670760182.0,,2022-12-11 14:03:02
Looking for advice,1,zio995,https://www.reddit.com/r/Tinder/comments/zio995/looking_for_advice/,23,1670757109.0,"I have met a very interesting guy on Tinder last weekend. There was a quick connection between us and we spent two days together. He was super nice and sweet and we had sex. However after two days he sent this message: ‘It seems my final weeks before the holidays are very busy. But I want to say that I enjoy your company. You are a super hot woman. Hope I brought some warmth into your weekend’ 
 So it looks like he doesn’t want to meet again😒. What it confuses me is the fact that he said ‘I enjoy your company’, could it be that he forgot the d of the past tense or he used the present on purpose to leave a door open or I am just over thinking the all thing. It is just that I hate this silly games and would prefer some honest communication. Any feedback will be appreciated. Thx 🌷",2022-12-11 13:11:49
"How do i find a fwb, if i right away tell them? or if i just go w the flow and and hope for the best?",8,zio48b,https://www.reddit.com/r/Tinder/comments/zio48b/how_do_i_find_a_fwb_if_i_right_away_tell_them_or/,20,1670756720.0,"Like do i tell them ‘i dont really looking for anything serious, but i dont want one nighters either, maybe a fwb having good time’ or should i just meet up w them and just try to move things in that direction?",2022-12-11 13:05:20
"Tinder premium, gold, platinum?!",2,zinkj0,https://www.reddit.com/r/Tinder/comments/zinkj0/tinder_premium_gold_platinum/,7,1670755179.0,"new to tinder and the dating apps scene, and I've got a question!

Is there a feature that I can buy to hide my profile unless I've swiped right on someone/liked them?

I live in a country with some social implications, and I'd rather keep an extra layer in case someone I know sees me.. Not a cheater lol!",2022-12-11 12:39:39
Mikalela Testa on Tinder (verified and Insta linked),14820,zilupd,https://i.redd.it/2z4u5q6l2a5a1.jpg,1550,1670750352.0,,2022-12-11 11:19:12
Maybe someone here can answer my question?? (OC),1,zilg4c,https://i.redd.it/i2ckkgk9z95a1.jpg,5,1670749234.0,,2022-12-11 11:00:34
tinder likes not refilling,3,zil2ef,https://www.reddit.com/r/Tinder/comments/zil2ef/tinder_likes_not_refilling/,5,1670748121.0,Does anyone know how to fix likes not refilling. I tried not using the app for a couple of days but i still only get 1 like before it show's the icon that i have no more likes.,2022-12-11 10:42:01
Fwb funny about me being on tinder,2,zikufo,https://www.reddit.com/r/Tinder/comments/zikufo/fwb_funny_about_me_being_on_tinder/,15,1670747497.0,"I had a fwb that has recently gone rather cold. I’m not usually in this city (which is hugeee), so I jumped back on tinder. The old fwb messaged me today saying “fool, stop matching with all my mates on tinder 😂😂.” 

I have never met his friends and of course I can’t see even their surnames let alone mutual friends so I wasn’t to know. Why does he care, he went rather cold with me recently and only hits me up when he’s drunk so why does he care enough to message me and say that?",2022-12-11 10:31:37
I'm liking this guy's thinking,929,zikmem,https://i.imgur.com/yKzzPc2.jpg,17,1670746896.0,,2022-12-11 10:21:36
Mini rant for gamers,4,zik6a8,https://www.reddit.com/r/Tinder/comments/zik6a8/mini_rant_for_gamers/,6,1670745639.0,"Man Tinder has the absolute worst gaming tags. It's mind blowing to me that they removed gamer/video games and have somehow still not managed to add anything comprable in. Especially while retaining the ""Gamers"" category/filter for swipes. I've even reached out to them and got a total non-answer. Anyone happen to know what the deal is with that? 

My money is just on the tag being too successful and they want you to remain on the app /tinfoil",2022-12-11 10:00:39
What,2,zijptn,https://i.imgur.com/mkigvvV.jpg,16,1670744119.0,,2022-12-11 09:35:19
"Ladies, if a guy messages you twice is it a deal breaker?",0,zijd5n,https://www.reddit.com/r/Tinder/comments/zijd5n/ladies_if_a_guy_messages_you_twice_is_it_a_deal/,33,1670742973.0,"There is this one girl I’ve been talking to that I’m super into but she always responds late and apologizes because she was busy. She’s not giving me dry answers, always full sentences with smiley faces and emojis. I understand being busy but for that to happen for each message is kind of weird. It’s been 6 days since I last messaged her and she hasn’t responded. I’ve read people saying NOT to message again because that shows desperation which most girls aren’t into, but at the same time I’m worried she might un match if we stop talking. Ladies, how long would you usually wait to unmatch someone after they sent their last message? Would it turn you away if a guy sends another message after you didn’t respond to the last one?",2022-12-11 09:16:13
"Match is creeping on me, should I be further concerned?",5,ziiiwr,https://www.reddit.com/r/Tinder/comments/ziiiwr/match_is_creeping_on_me_should_i_be_further/,17,1670740908.0,"Hey all, this is a weird one - I had a match who very quickly in the conversation gave off really creepy and uncomfortable vibes. I have a hard time setting boundaries or saying no, so I just left the conversation alone. This person managed to track down my profile on other apps and has more worryingly found my Instagram despite me not having the account name anywhere on any of those profiles. Seeing as they found my Instagram, they now potentially have my first and last name (if they remembered before I blocked them, especially since my last name is part of my account name.)

Im really concerned at a) how they found that information and b) what else they might know, especially because there were no mutual connections (to my knowledge) that this person could have used to find my Instagram out. I have blocked on all the accounts He found me on and reported as well - are my concerns based in reality or am I over reacting? If my concerns are valid, should I be worried further? Are there things I can do to protect myself further?

Thanks for taking the time to read; I’m thoroughly rattled by this.

Edit: further info that I think may be relevant is that this is happening in the NYC metro, so it’s not like it’s a small match pool that this is happening in.",2022-12-11 08:41:48
Her profile said something about making memories 🤷🏼‍♂️,10,ziiegp,https://i.redd.it/i43rcckp995a1.jpg,5,1670740640.0,,2022-12-11 08:37:20
This one doesn’t make it hard to figure out I should swipe left,15,zii1l8,https://www.reddit.com/gallery/zii1l8,7,1670739858.0,,2022-12-11 08:24:18
I get men like hunting and farming but who thinks this is an attractive first impression? Sounds like killing just to kill.,3,zihbpr,https://i.redd.it/sn0ynams295a1.jpg,26,1670738314.0,,2022-12-11 07:58:34
As if you guys didn’t have it bad enough already…,0,zihb1b,https://i.redd.it/f4ls8f2o295a1.jpg,7,1670738272.0,,2022-12-11 07:57:52
I’m just going to respond in the most unhinged manner from now on when I get stuff like this.,2858,zih4st,https://i.redd.it/okq7ez5i195a1.jpg,50,1670737880.0,,2022-12-11 07:51:20
I…I mean…I mean I guess at least she’s honest ??💀💀,0,zieu3n,https://i.redd.it/u7xtrhspm85a1.jpg,33,1670732909.0,,2022-12-11 06:28:29
Its that simple,0,zietxd,https://i.redd.it/nmxs6f8om85a1.jpg,10,1670732893.0,,2022-12-11 06:28:13
Banned Account,1,zie65v,https://www.reddit.com/r/Tinder/comments/zie65v/banned_account/,6,1670731367.0,"Hey there, so I made an tinder account years ago when I was underage. Obviously, it ended up getting banned. But I was wondering how I could get it unbanned?

No other dating app seems to work for me so I wanted to try coming to tinder. Didn’t even realize my account was banned.",2022-12-11 06:02:47
Why so many Sagittarius girls on Tinder? (I don't even believe in horoscopes),0,zidhhb,https://www.reddit.com/r/Tinder/comments/zidhhb/why_so_many_sagittarius_girls_on_tinder_i_dont/,16,1670729894.0,"Newbie on tinder, but why there's so many Sagittarius girls on Tinder? I counted, it's 7 out of 10 profiles, I don't understand why, but I thought it's interesting :)",2022-12-11 05:38:14
are these pictures any good? (plz rate),10,zidcaa,https://i.redd.it/cng4g5qsc85a1.png,25,1670729573.0,,2022-12-11 05:32:53
"her bio said ""Free swimming lessons."" What did I do wrong?",407,zicv8w,https://i.redd.it/r1vcpq5w985a1.jpg,171,1670728594.0,,2022-12-11 05:16:34
Asking chatgpt for some flirt lines,64,zicu4u,https://i.redd.it/a6emwxxo985a1.jpg,9,1670728527.0,,2022-12-11 05:15:27
lmao wtf,97,zic45p,https://i.redd.it/630vuobo485a1.jpg,19,1670726840.0,,2022-12-11 04:47:20
Well this is a new one for me,3092,zibs02,https://i.redd.it/22h3fuem285a1.jpg,484,1670726149.0,,2022-12-11 04:35:49
"Banned From Tinder, Before having an account.",4,zibove,https://www.reddit.com/r/Tinder/comments/zibove/banned_from_tinder_before_having_an_account/,1,1670725976.0,"Hey! So I’ve been bickering with staff via email about this problem, but too little effort seems to be put into my case for me to just walk away.
I have recently became legal age to use tinder, however, a month prior I was to told to use my ID to verify that I am now of age, which I did. While waiting for said ID to get verified, (which is something you do before even getting an account) I have been told I am banned from the app, I have not once ever used this app, and there should be no activity on said “account” to prove it. I ask repeatedly what Terms of Service I have committed, though, I doubt I even have an account, and I must assume that my number has been banned from accessing the app. It seems like unless I swap my SIM card, I will not be allowed access into the app ever.
TLDR;
Account banned, never used the app, staff refuse to tell me what has potentially happened.
Thank you for your time.",2022-12-11 04:32:56
New to tinder,0,zibfz0,https://www.reddit.com/r/Tinder/comments/zibfz0/new_to_tinder/,3,1670725481.0,19 male downloaded tinder three hours ago got tinder plus. So far 16 likes and two matches. What’s the average for a guy?,2022-12-11 04:24:41
what is it with tinder these days?,4,zib09j,https://i.redd.it/c38hemnyx75a1.jpg,36,1670724602.0,,2022-12-11 04:10:02
🔥🔥🔥 Improving Tinder Poll 🔥🔥🔥,0,ziauf5,https://www.reddit.com/r/Tinder/comments/ziauf5/improving_tinder_poll/,12,1670724283.0,"If you could choose either of the following options to change about Tinder, which would you go with?

Vote first, then comment if you have other suggestions. What do you wish you could change/implement?

[View Poll](https://www.reddit.com/poll/ziauf5)",2022-12-11 04:04:43
Can't tell if this is serious or not...,12,ziallb,https://i.redd.it/7qeoet8kv75a1.jpg,6,1670723775.0,,2022-12-11 03:56:15
Why tho?,703,zi9h6c,https://www.reddit.com/gallery/zi9h6c,87,1670721098.0,,2022-12-11 03:11:38
[OC] … a 1300 mile commute,11,zi9buo,https://i.redd.it/7qpvd7ffm75a1.jpg,8,1670720703.0,My sister intentionally matches with scammers for the giggles 🤭,2022-12-11 03:05:03
20M any suggestions for my profile?,6,zi93va,https://www.reddit.com/gallery/zi93va,19,1670720130.0,,2022-12-11 02:55:30
Ummm excuse me?,116,zi8wch,https://i.redd.it/zld0agvxi75a1.jpg,18,1670719539.0,,2022-12-11 02:45:39
Is this how you do it?,64,zi8qgc,https://i.redd.it/grtwdlrnh75a1.jpg,5,1670719099.0,,2022-12-11 02:38:19
I think the conversation is going well,8,zi8ptu,https://i.redd.it/3nws2djjh75a1.jpg,4,1670719059.0,,2022-12-11 02:37:39
thoughts on buying a small gift on a third date?,2,zi8g5f,https://www.reddit.com/r/Tinder/comments/zi8g5f/thoughts_on_buying_a_small_gift_on_a_third_date/,11,1670718345.0,"going to a christmas parade and christmas shopping, and i was thinking about buying her something small like a bracelet. she doesn’t wear too much jewelry but i don’t know what else i could buy her.

i’m worried i’d be coming on too strong but with a heavy christmas theme tonight i figured i could give it a try. any thoughts?",2022-12-11 02:25:45
Was I banned for this joke?,14,zi8257,https://www.reddit.com/r/Tinder/comments/zi8257/was_i_banned_for_this_joke/,5,1670717329.0,"His opening line: 
“You need to be taken care of”

My response: 
“Are you hitting on me?”
“Or putting out a hit on me” 

I thought my response was funny. Godfather-toned. Did I go too far? 

His message is technically nice. But there’s something that creeps me out. 

Did he report me?",2022-12-11 02:08:49
I finally got a good line,36,zi7jgd,https://www.reddit.com/gallery/zi7jgd,13,1670715967.0,,2022-12-11 01:46:07
surely this can't be the best my city has to offer.,0,zi7fn5,https://i.redd.it/53sk19qi775a1.jpg,11,1670715689.0,,2022-12-11 01:41:29
We were just talking about how we like the area since we both recently moved here,14,zi7dkx,https://i.redd.it/01ht9tu2775a1.jpg,3,1670715541.0,,2022-12-11 01:39:01
How to say goodbye?,0,zi7a7u,https://www.reddit.com/r/Tinder/comments/zi7a7u/how_to_say_goodbye/,6,1670715299.0,"I met a girl on tinder, and we both went on a lunch date once. We have been texting back and forth for a while and after a while,  I stopped texting her because I didn't feel we were the right match. How can I say goodbye to her for good? She is a lovely person but not a suitable match for me.",2022-12-11 01:34:59
UM,20,zi6yzn,https://i.redd.it/yr64mpez375a1.jpg,8,1670714501.0,,2022-12-11 01:21:41
Why would you ever ask this?,89,zi6wtl,https://i.redd.it/i5zyvh4k375a1.jpg,21,1670714357.0,,2022-12-11 01:19:17
He just couldn’t take no for an answer,33,zi6fvs,https://www.reddit.com/gallery/zi6fvs,73,1670713190.0,,2022-12-11 00:59:50
?,11,zi6due,https://i.redd.it/i6rah8voz65a1.jpg,8,1670713057.0,,2022-12-11 00:57:37
Oldie but a goodie,8,zi642n,https://i.redd.it/jfer1uqqx65a1.jpg,2,1670712401.0,,2022-12-11 00:46:41
What a peach,40,zi5tlq,https://i.redd.it/lezekmylv65a1.jpg,5,1670711688.0,,2022-12-11 00:34:48
Gonna need a decipher on this one,6,zi5oip,https://www.reddit.com/gallery/zi5oip,13,1670711352.0,"Okay, I admit I was a bit thirsty",2022-12-11 00:29:12
Wow what a catch 😑,26,zi5l2k,https://www.reddit.com/gallery/zi5l2k,36,1670711131.0,,2022-12-11 00:25:31
I don’t know how I managed this. She cosplays Marvel and I’m an engineering student.,1663,zi55my,https://i.redd.it/hz1am0jxq65a1.jpg,126,1670710111.0,"Like, I thought it was a good match when I saw her bio but sheesh how did I stumble into my teenage self’s absolute dream.",2022-12-11 00:08:31
"Apparently if I wanna go out with this chick, I have to pass a criminal background check",0,zi4yfs,https://i.redd.it/ju96xavjp65a1.jpg,35,1670709647.0,,2022-12-11 00:00:47
"Finish this off. Her bio said ""what's your favourite form of potato?""",13012,zi4udc,https://i.redd.it/f1oh5czso65a1.png,3124,1670709396.0,,2022-12-10 23:56:36
Why do some people put as little effort in as possible?,27,zi4q5f,https://www.reddit.com/gallery/zi4q5f,41,1670709114.0,I tend to mirror peoples’ energy - and this was like a long slow death,2022-12-10 23:51:54
And I won’t waste mine… thanks for the heads up,14,zi4446,https://i.redd.it/871nq75qj65a1.jpg,2,1670707687.0,,2022-12-10 23:28:07
Wish me luck!,91,zi3uue,https://i.redd.it/0vqidlpzh65a1.jpg,21,1670707104.0,,2022-12-10 23:18:24
[UPDATE] I made a post yesterday and got a few comments for an update so here it is. I picked her up from her apartment. Got some head on the way back to my place and the rest is history. (More details in comments) She was really fun in and out of bed and I plan to chill with her again.,42,zi3t7m,https://i.redd.it/utrnsz8oh65a1.jpg,10,1670706997.0,,2022-12-10 23:16:37
What's the catch,8,zi3ngn,https://i.redd.it/pgot4melg65a1.png,31,1670706634.0,,2022-12-10 23:10:34
Is this a fairly decent bio? What are your thoughts/suggestions. I’m horrible at bios,0,zi3l18,https://i.redd.it/y260mtr4g65a1.jpg,16,1670706479.0,,2022-12-10 23:07:59
"and this ladies and gentlemen, is what rejection will do to an insecure man.",75,zi3imj,https://www.reddit.com/gallery/zi3imj,58,1670706318.0,,2022-12-10 23:05:18
He doesn’t use pronouns…except 6 times.,90,zi3324,https://i.redd.it/88mggpajc65a1.jpg,59,1670705274.0,,2022-12-10 22:47:54
"Shame on her for lying, but props to her for exposing the lie quickly (her insta advertises the thing she isn’t selling)",0,zi31xq,https://i.redd.it/hqvj22hbc65a1.jpg,12,1670705197.0,,2022-12-10 22:46:37
We’ve been talking for 3 minutes… then he asks me to explain my job working in DEIA in Academia then uses it as an in to tell me his politics?,0,zi2xon,https://i.redd.it/w3sofxhfb65a1.jpg,11,1670704897.0,,2022-12-10 22:41:37
Looks like my weekend is off to a good start!,47,zi2nta,https://i.redd.it/sjud556g965a1.jpg,13,1670704231.0,,2022-12-10 22:30:31
Can someone explain to me what this is?,0,zi2i3g,https://i.redd.it/gjbglu3b865a1.jpg,61,1670703847.0,,2022-12-10 22:24:07
Any tips or advice?,4,zi24af,https://www.reddit.com/gallery/zi24af,33,1670702928.0,,2022-12-10 22:08:48
"Does anyone really need this reminder pop up every three minutes (or even at all after being on the app for more than a day), blocking profile info every time until it goes away?",12,zi19ca,https://i.redd.it/5jugyomkz55a1.jpg,1,1670700909.0,,2022-12-10 21:35:09
And I thought I had standards,6,zi185q,https://www.reddit.com/gallery/zi185q,10,1670700828.0,,2022-12-10 21:33:48
"I'm on a work trip to Bangkok. I have been here like 24 hours. Any ideas on why this happens? Like I do get matches at home as well, but not as many in such a short time...",0,zi0vz3,https://www.reddit.com/r/Tinder/comments/zi0vz3/im_on_a_work_trip_to_bangkok_i_have_been_here/,46,1670699984.0,"&#x200B;

[most of it is censored just in case but damn never had so many matches, and they are even verified.](https://preview.redd.it/2plbnd4ze45a1.png?width=718&format=png&auto=webp&s=94c003850f7b09be13e1104d00bb5f252e89362f)",2022-12-10 21:19:44
Left hanging!,22,zi08m9,https://i.redd.it/yywzzcl2s55a1.jpg,3,1670698387.0,I will never know.,2022-12-10 20:53:07
Found this profile today. This was all that was on it…,7,zhzxfd,https://i.redd.it/if2gq5lrp55a1.jpg,10,1670697611.0,,2022-12-10 20:40:11
"Help with profile 2.0, please.",1,zhzvmi,https://www.reddit.com/gallery/zhzvmi,9,1670697489.0,,2022-12-10 20:38:09
When she exposes herself as a bigot…,2,zhzrbw,https://i.redd.it/q2h30mdio55a1.jpg,11,1670697189.0,Dealbreaker.,2022-12-10 20:33:09
"Finally beat Tinder, anybody have new games to play?",52,zhzobb,https://i.redd.it/dcovb5gxn55a1.jpg,14,1670696994.0,,2022-12-10 20:29:54
Will the likes I got ever be available?,2,zhzcq2,https://www.reddit.com/r/Tinder/comments/zhzcq2/will_the_likes_i_got_ever_be_available/,8,1670696214.0,"So the app shows that I got 8+ likes and keeps them behind Tinder Gold. Will these people ever appear, or are they stuck behind a paywall forever? It's been the same blurred faces for a few days. Or are these just random pictures of people that haven't liked me in the first place?

I'm just very curious and want to figure out how it works.",2022-12-10 20:16:54
How do you go about tinder when you want to only fuck?,5,zhywpg,https://www.reddit.com/r/Tinder/comments/zhywpg/how_do_you_go_about_tinder_when_you_want_to_only/,37,1670695176.0,Like… do you put it blatantly in your bio or what? I can’t seem to match with anyone who just wants to fuck…,2022-12-10 19:59:36
Truly speechless.,23317,zhyq4q,https://i.redd.it/ksuoyt6pz35a1.jpg,539,1670694738.0,,2022-12-10 19:52:18
There’s weight requirements now?,3872,zhyiy3,https://i.redd.it/mo46tfjrf55a1.jpg,910,1670694260.0,,2022-12-10 19:44:20
Question about first Text´s,2,zhyf3y,https://www.reddit.com/r/Tinder/comments/zhyf3y/question_about_first_texts/,2,1670693996.0,"Hello everyone, this question is for the women on Tinder :  
I know every women differs just like men when it comes to personality but as a genuine question, is it okey to just write simple things like ""Hey""  or something as an opener ?",2022-12-10 19:39:56
His motto: move on and try again,87,zhxtju,https://www.reddit.com/gallery/zhxtju,32,1670692568.0,,2022-12-10 19:16:08
Banned for no apparent reason..,2,zhxsq6,https://www.reddit.com/r/Tinder/comments/zhxsq6/banned_for_no_apparent_reason/,0,1670692513.0,"I recently was banned from both Tinder and Hinge for violating their terms of use. After noticing this I read through their terms of use to see what I might have violated. I’ve never said or done anything that would’ve violated their terms, never misrepresented myself, but one time I deleted the app (but not my account) and eventually downloaded it again, but forgot my login info. I innocently created a new account with most the same information, so I believe I got banned for having multiple accounts. 

I appealed this and got a generic response from both hinge and tinder (owned by the same company) that they weren’t taking appeals at this time. 

What gives? And how can I delete an unused account so that this doesn’t happen?",2022-12-10 19:15:13
Why dating is tough ? I don’t know,11,zhxskr,https://i.redd.it/4ynjka7la55a1.jpg,6,1670692508.0,,2022-12-10 19:15:08
Tinder Error Failed to match with...,3,zhxjbo,https://www.reddit.com/r/Tinder/comments/zhxjbo/tinder_error_failed_to_match_with/,0,1670691878.0,"I recently got Tinder platinum, but at the moment I tried to match with the people who had liked me during the noob boost, the message “Error failed to match with...”, the person completely disappears from my feed. 

This has happened with more than 5 different people already! I could match with people before buying Platinum...

They also asked me for verifying if I was a human. It has happened to any of you before?",2022-12-10 19:04:38
"Those are my pics in that order. Please give me constructive feedback, I appreciate every helpful comment of y’all!",3,zhxet4,https://www.reddit.com/gallery/zhxet4,6,1670691586.0,,2022-12-10 18:59:46
Has anyone actually paid for tinder gold and had results?,1,zhxddv,https://i.redd.it/j18l3vxj755a1.jpg,8,1670691487.0,,2022-12-10 18:58:07
i finally got to use the obi-wan line. my dissapointment is immeasurable.,84,zhx8n1,https://i.redd.it/r8gwpcbh655a1.jpg,14,1670691126.0,,2022-12-10 18:52:06
Having fun with Tinder scammers,1575,zhx27r,https://i.redd.it/4uo33sc2555a1.jpg,38,1670690650.0,,2022-12-10 18:44:10
Shes literally only on here to get more followers,10,zhwp6m,https://www.reddit.com/gallery/zhwp6m,7,1670689727.0,,2022-12-10 18:28:47
what does being tall have anything to do with travelling? 🤦🤦🤦,0,zhwe8v,https://i.redd.it/g2m7r4b2055a1.jpg,12,1670688968.0,,2022-12-10 18:16:08
"Her Bio stated that she wanted attention and kisses and was frustrated that she wasn’t getting them, I wonder why.",30,zhwd3g,https://i.redd.it/4rccmbetz45a1.jpg,12,1670688886.0,,2022-12-10 18:14:46
Why do women do this…,534,zhwbx8,https://i.imgur.com/WIQNkWN.png,230,1670688801.0,,2022-12-10 18:13:21
Some help,1,zhw9xs,https://www.reddit.com/r/Tinder/comments/zhw9xs/some_help/,4,1670688663.0,Hello im quite new to tinder and asking for some help please i match with other people but it dont show the other matches is this normal and how do i message someone it says i got liked but wont let me view it as i know it require tinder gold my main question is how do i actually talk to someone as there is no talk prompt there many thanks,2022-12-10 18:11:03
